{
  "anumber": "A10712436",
  "id": "A10712436_0000",
  "page_index": 0,
  "resources": {
    "full_jpg": "https://dctn4zjpwgdwdiiy5odjv7o2se0bqgjb.lambda-url.us-east-1.on.aws/iiif/3/og-2023-kc-nara_A10712436_0000/full/max/0/default.jpg"
  },
  "fields": {
    "sex": {
      "ms_sex_llm_v1": "female"
    },
    "doctype": {
      "ms_doctype_v1": "form"
    },
    "form_title": {
      "ms_form_title_llm_v1": "Processing Sheet"
    },
    "countries": {
      "ms_countries_nlp_v1": [
        "United States"
      ]
    },
    "years": {
      "ms_years_nlp_v1": [
        1996
      ]
    }
  },
  "is_g325a": false,
  "is_cert_naturalization": false,
  "full_text": "U.S. Department of Immigration and Naturalization Service DEPARTMENT D 0 PROCESSING SHEET File No: A 10712436 DESCRIPTION SECTION OF LAW Sex: Male Female 316(a) 325 Marital Status: Single Married Divorce 1 WidonsAnt 319(a) 328 Height: Feet S Inches 0 319(b) 329 Nationality: Elsaluador 322 405 FINAL ACTION INITIAL INTERVIEW: MAY 21 1996 English 65/20 (Date) Denial: Date & Initials 0 Speaks Reads Writes iiÂ° Understands ] Withdrawal: Date & Initials Government: OK LNS E.T.S. CASAS NAS Oath Taken Certificate Issued: REEXAM: ACTION or DOCUMENTS REQUIRED (Date and Initials) See Attached N-14b Reexamination SEC DOCUMENTS PRESENTED Visa File Post Audit A.R.C. : 10712436 Other: D.O.B. : 2-2-83 P.O.E. : BRO C.O.A.: 0-1 COMMENTS D.O.E. : 01-9-57 CID/CDL : N0059160 Recommendation 6P JR. AF APPROVAL (STAMP) FINAL HEARING INS DISTRICT DIRECTOR 8/9/96 MAY 9.1 1996 DATE Joseph 8 Recommended by: LOS 4688 TIME Attorney Waiver Executed. If Attorney Present, List Name: 3 Months Residence OK Fingerprints NEG. 40 Nazi Negative Day-Time Phone: ( 310 ) - 925 - 4265 Ext OATH OF ALLEGIANCE Name Change: now Modified Oath; Delete Part(s): Promise to Bear Arms, Noncombat Duty OATH WITH U.S. DISTRICT COURT: 246 Jane I HEREBY DECLARE, on oath. That I absolutely and entirely renounce and abjure all allegiance and fidelity to any foreign prince, potentate, state, or sovereignty of whom or which I have heretofore been a subject or citizen; That I will support and defend the Constitution and the laws of the United States of America against all enemies, foreign and domestic; that I will bear true faith and allegiance to the same; that I will bear arms on behalf of the United States when required by the law, that I will perform noncombatant service in the Armed Forces of the United States when required by the law, that I will perform work of national importance under civilian direction when required by the law; and that I take this obligation freely, without any mental reservation or purpose of evasion; so HELP ME God. In acknowledgment whereof I have hereunto affixed my signature. Form I-468 Signature: Rosa fominta Renderos"
}