{
  "anumber": "A19055851",
  "id": "A19055851_0049",
  "page_index": 49,
  "resources": {
    "full_jpg": "https://dctn4zjpwgdwdiiy5odjv7o2se0bqgjb.lambda-url.us-east-1.on.aws/iiif/3/og-2023-kc-nara_A19055851_0049/full/max/0/default.jpg"
  },
  "fields": {
    "sex": {
      "ms_sex_llm_v1": "male"
    },
    "doctype": {
      "ms_doctype_v1": "form"
    },
    "form_title": {
      "ms_form_title_llm_v1": "BIOGRAPHIC INFORMATION, FORM G-325 A ( (REV. 9-1-69)"
    },
    "countries": {
      "ms_countries_nlp_v1": [
        "Germany",
        "Pakistan",
        "United States",
        "Canada"
      ]
    },
    "years": {
      "ms_years_nlp_v1": [
        1949,
        1884,
        1934,
        1976,
        1883
      ]
    },
    "g325a": {
      "occupation": {
        "occupation_llm_v1": "[' butler', 'counselor', ' salesman']"
      },
      "reason": {
        "reason_llm_v1": "NATURALIZATION"
      },
      "nationality": {
        "nationality_llm_v1": "So. Africa"
      }
    }
  },
  "is_g325a": true,
  "is_cert_naturalization": false,
  "full_text": "LOS FORM G-325 A (REV. 9-1-69) Form Approved CTT - 400 Budget Bureau No. 43-R436 BIOGRAPHIC UNITED STATES DEPARTMENT OF JUSTICE INFORMATION Immigration and Naturalization Service APR 19 1976 (Family name) (First name) (Middle name) BIRTHDATE (Mo.-Day-Yr.) NATIONALITY ALIEN REGISTRATION NO. MALE (If any) WOLFSON, George FEMALE 12-9-09 So. Africa A19 055 851 ALL OTHER NAMES USED CITY AND COUNTRY OF BIRTH SOCIAL SECURITY NO. (If any) Karachi, Pakistan 571-88-2864 FAMILY NAME FIRST NAME DATE, CITY AND COUNTRY OF BIRTH (If known) CITY AND COUNTRY OF RESIDENCE WOLFSON, Tleselrazar 4-5-1883 Rumania Deceased FATHER SVAMUUR, Sarah 4-21-1884 Br. India Deceased MOTHER (Maiden name) SPOUSE (If none, so state) FAMILY NAME FIRST NAME BIRTHDATE CITY & COUNTRY OF BIRTH DATE OF MARRIAGE PLACE OF MARRIAGE (For wife, give maiden name) Hedwig Osterode, Las Vegas, DZIOMBA Heldegard 4-8-20 Germany 11-2-69 Nevada FORMER SPOUSES (If none, so state) FAMILY NAME (For wife, give maiden name) FIRST NAME BIRTHDATE DATE & PLACE OF MARRIAGE DATE AND PLACE OF TERMINATION OF MARRIAGE JAMES Rebecca 1907 Jan. 1934, Toronto, June 22, 1949, Florida Canada APPLICANT'S RESIDENCE LAST FIVE YEARS. LIST PRESENT ADDRESS FIRST. FROM TO STREET AND NUMBER CITY PROVINCE OR STATE COUNTRY MONTH YEAR MONTH YEAR 10717 Wilshire Blvd Los Angeles CA USA 8 73 PRESENT TIME 1510 Bevery Hills Bev. Hills CA USA 6 70 8 73 312 No. Faring Rd Los Angeles CA USA 7 68 6 70 Show below last foreign residence of more than one year if not shown above. (Include all information requested above.) Sutoton Hotel Apts. Bay ST. Toronto CANADA 8 67 5 68 APPLICANT'S EMPLOYMENT LAST FIVE YEARS. (IF NONE, so STATE.) LIST PRESENT EMPLOYMENT FIRST. FROM TO FULL NAME AND ADDRESS OF EMPLOYER OCCUPATION (SPECIFY) MONTH YEAR MONTH YEAR Renee of Beverly Domestic Agency; Beverly Hills Counselor APR 75 PRESENT TIME Bernard Greeff; Santa Barbara Butler JAN 75 MAR 75 Telecredit Corp/1800 Ave of the Stars/L.A., CA Salesman NOVE 74 DEC 74 Beverly Linclon Mercury & Ford/Berverly Hills/L.A/CA safesman OCT 72 NOV 73 Mr. Nutten/718 Creseent Dr. /Beverly Hills Butler MAR 72 SEPT 72 Show below last occupation abroad if not shown above. (Include all information requested above.) Coffee Bean, Toronto, Canada John Manager JAN 67 MAR 67 THIS FORM IS SUBMITTED IN CONNECTION WITH APPLICATION FOR: SIGNATURE OF APPLICANT OR PETITIONER DATE NATURALIZATION ADJUSTMENT OF STATUS OTHER (SPECIFY): 5-23-75 PENALTIES: SEVERE PENALTIES ARE PROVIDED BY LAW IF YOUR NATIVE ALPHABET IS IN OTHER THAN ROMAN LETTERS, WRITE YOUR NAME IN YOUR NATIVE ALPHABET IN THIS SPACE: FOR KNOWINGLY AND WILLFULLY FALSIFYING OR CONCEALING A MATERIAL FACT. APPLICANT'S EMPLOYMENT LAST FIVE YEARS. (IF NONE, so STATE.) LIST PRESENT EMPLOYMENT FIRST. FROM TO FULL NAME AND ADDRESS OF EMPLOYER OCCUPATION (SPECIFY) MONTH YEAR MONTH YEAR B.D. Kelgs / Rancho Santa FÃ© / Madre Selva, CA Butler JULY 71 MAR 72 J. P. Langley / 635 Park Ave / New York, N.Y. Butler JUNE 71 JULY 71 Barbara Weinburg / Drur Lane / L.A., CA Butler FEB 71 MAR 71 J. Moss / 312 Faring Road / Los Angeles, CA Butler JULY 69 OCT 70"
}