{
  "anumber": "A19240402",
  "id": "A19240402_0074",
  "page_index": 74,
  "resources": {
    "full_jpg": "https://dctn4zjpwgdwdiiy5odjv7o2se0bqgjb.lambda-url.us-east-1.on.aws/iiif/3/og-2023-kc-nara_A19240402_0074/full/max/0/default.jpg"
  },
  "fields": {
    "sex": {
      "ms_sex_llm_v1": "female"
    },
    "doctype": {
      "ms_doctype_v1": "form"
    },
    "form_title": {
      "ms_form_title_llm_v1": "United States Department of Justice Immigration and Naturalization Service, G-325A ( (REV. 8-27-72)N"
    },
    "countries": {
      "ms_countries_nlp_v1": [
        "United States"
      ]
    },
    "years": {
      "ms_years_nlp_v1": [
        1966,
        1907,
        1903,
        1972,
        1872
      ]
    },
    "g325a": {
      "occupation": {
        "occupation_llm_v1": "['housewife']"
      },
      "reason": {
        "reason_llm_v1": "NATURALIZATION"
      },
      "nationality": {
        "nationality_llm_v1": "Hungarian"
      }
    }
  },
  "is_g325a": true,
  "is_cert_naturalization": false,
  "full_text": "FORM G-325A (REV. 8-27-72)N Form Approved UNITED STATES DEPARTMENT OF JUSTICE OMB No. 43-R436 Immigration and Naturalization Service BIOGRAPHIC INFORMATION (Family name) (First name) (Middle name) MALE BIRTHDATE(Mo.-Day-Yr.) NATIONALITY ALIEN REGISTRATION NO. NEMETH ANNA Gabriella FEMALE 3-16-1907 Huggground (If any) 419-240-402 ALL OTHER NAMES USED (Including names by previous marriages) CITY AND COUNTRY OF BIRTH BudAPEst- Hungory SOCIAL SECURITY NO. 326-54-4043 FAMILY NAME FATHER KARDOS. Dezso. 1872 Veszprem Hungery- Deceased FIRST NAME DATE, CITY AND COUNTRY OF BIRTH(If known) CITY AND COUNTRY OF RESIDENCE MOTHER(Maiden name) Csipes. Julienna. 1886 MEZOTUR. Deceased HUSBAND (If none, so state) FAMILY NAME FIRST NAME BIRTHDATE CITY & COUNTRY OF BIRTH DATE OF MARRIAGE PLACE OF MARRIAGE OR (For wife, give maiden name) WIFE n/A FORMER HUSBANDS OR WIVES(i none, so state) FAMILY NAME (For wife, give maiden name) FIRST NAME BIRTHDATE DATE & PLACE OF MARRIAGE DATE AND PLACE OF TERMINATION OF MARRIAGE Nemeth Gabor 1903 / 929 Minor 1966 Hungery by Death APPLICANT'S RESIDENCE LAST FIVE YEARS. LIST PRESENT ADDRESS FIRST. Hangary FROM TO STREET AND NUMBER CITY PROVINCE OR STATE COUNTRY MONTH YEAR MONTH YEAR 3172 N.Shendan Chicogo Illinois U.S.A Jan. 1972 PRESENT TIME APPLICANT'S LAST ADDRESS OUTSIDE THE UNITED STATES OF MORE THAN ONE YEAR FROM TO STREET AND NUMBER CITY PROVINCE OR STATE COUNTRY MONTH YEAR MONTH YEAR 6735Malkenner Schlorssth APPLICANT'S EMPLOYMENT LAST FIVE YEARS. (IF NONE, so STATE.) LIST PRESENT EMPLOYMENT FIRST. 2/23 Gemmy- FROM TO FULL NAME AND ADDRESS OF EMPLOYER OCCUPATION (SPECIFY) MONTH YEAR MONTH YEAR Housewife PRESENT TIME Housewife FORM IS SUBMITTED IN CONNECTION WITH Show below last occupation abroad if not shown above. (Include all information requested above.) THIS APPLICATION FOR: SIGNATURE OF APPLICANT OR PETITIONER NATURALIZATION times Neweth 3/8/74 DATE ADJUSTMENT OF STATUS OTHER (SPECIFY): IF YOUR NATIVE ALPHABET is IN OTHER THAN ROMAN LETTERS. WRITE YOUR NAME IN YOUR NATIVE ALPHABET IN THIS SPACE: Are all copies legible? Yes PENALTIES SEVERE PENALTIES ARE PROVIDED BY LAW FOR KNOWINGLY AND WILLFULLY FALSIFYING OR CONCEALING A MATERIAL FACT."
}