{
  "id": "A19529822_0031",
  "page_index": 31,
  "resources": {
    "full_jpg": "https://dctn4zjpwgdwdiiy5odjv7o2se0bqgjb.lambda-url.us-east-1.on.aws/iiif/3/og-2023-kc-nara_A19529822_0031/full/max/0/default.jpg",
    "ocr_txt": true
  },
  "fields": {
    "sex": {
      "ms_sex_llm_v1": "female"
    },
    "doctype": {
      "ms_doctype_v1": "form"
    },
    "form_title": {
      "ms_form_title_llm_v1": "APPLICATION FOR STATUS AS PERMANENT RESIDENT, 443-R0400"
    },
    "is_g325a": false,
    "is_cert_naturalization": false,
    "countries": {
      "ms_countries_nlp_v1": [
        "Pakistan",
        "United States",
        "India"
      ]
    },
    "years": {
      "ms_years_nlp_v1": [
        1937,
        1972,
        1935,
        1948,
        1938,
        2023,
        1906,
        1932,
        1924
      ]
    }
  },
  "anumber": "A19529822",
  "full_text": "$25 Screened by NARA, 7/13/2023 Form Approved Budget Bureau No. 43-R0400 APPLICATION FOR STATUS AS PERMANENT RESIDENT FEE STAMFINFORMATION File No. APPLICATION FOR THE BENEFITS OF SECTION: JUL10.1972 203(a)(7) and Sec. 245, I&N Act 245 (14B 249 I&N Act Immigration Sec. 214(d), I&N Act Service Sec. 13, Act of 9/11/57 NM (DO NOT WRITE ABOVE THIS LINE.) (SEE INSTRUCTIONS BEFORE FILLING IN APPLICATION. IF YOU NEED MORE SPACE TO ANSWER FULLY ANY QUESTION ON THIS FORM, USE A SEPARATE SHEET AND IDENTIFY EACH ANSWER WITH THE NUMBER OF THE CORRESPONDING QUESTION. FILL IN WITH TYPEWRITER OR PRINT IN BLOCK LETTERS IN INK.) 1. I hereby apply for the status of a lawful permanent resident alien on the following basis: (Check box A, B, C, D, E or F) An immigrant visa is immediately available to me: A. As a refugee (Section 203(a)(7) and Section 245, I&N Act). B. As a former fiancee or fiance of a U.S. citizen whom I married within 90 days after my arrival in the United States, or as a child of such fiancee or fiance (Section 214(d), I&N Act). C. As a former government official, or as a member of the immediate family of such official (Section 13, Act of September 11, 1957). D. As a person to whom. an immigrant visa is immediately available, other than one described above, (Section 245, I&N Act). E. As a person who has resided in the United States continuously since prior to July 1, 1924 (Section 249, I&N Act). F. As a person who has resided in the United States continuously since a date on or after July 1, 1924, but before June 30, 1948 (Section 249, I&N Act). A19529822 2. My name is (Last in capital letters) (First Name) (Middle Name) My alien registration number is Sex Male WADHWANI DURUPADI JAGATRAI - Female 3. I reside in the United States at: (Apt. No.) (No. and Street) (City) (State) (ZIP Code) 18K PERU 97/11 HORACE HARDING EXPWY, LAFRAK CITY, N.Y. N.Y. 11368 4. Date of Birth Place of Birth (City or Town) (County, Province, or State) (Country) I am now a citizen of (Country) NOV.28,1906 1 KARACHI WEST PAKISTAN INDIA 5. I last arrived in the United States at the port of (City and State) on (Month) (Day) (Year) NEW YORK CITY N.Y APRIL 8,1972 by (Name of vessel or other means of travel) as a (visitor, student, exchange visitor, temporary worker, fiancee, fiance, crewman, AIR INDIA parolee, etc.) VISITOR was My nonimmigrant visa was issued by the United States Consul at (City) (State) on (Month) (Day Year) inspected. was not BOMBAY INDIA 005929 APRIL3 1972 6. I am single married divorced widowed a. I have been married ONE times, including my present marriage, if now married. (If you are now married give the following:) b. Number of times my spouse has been married C. Name of spouse ONCE WADHWANI JAGATRAI MULRAM d. My spouse resides with me apart from me at Address (Apt. No.) (No. & Street) (Town or City) (Province or State) (Country) 7. a. I have NINE children, as follows: (complete all columns as to each child. If child lives with you, state \"with me\" in last column; otherwise give city and state or country of child's residence. Name Sex Place of Birth Date of Birth Now Living at (1) SARASWATI F WEST PAKISTAN 7/5/1932 WITH ME 5 (2) GOBIND M 1. 41111934 Pr \" 8 (3) KAMALA F \" A 7/17/1935 N.Y.CITY, N.Y. USA (4) MOHAN M Pr \" 8/1/1937 CALIFORNIA, LA, U.S.A. (5). BHAGWAN M 4 12/22/1938 b. The following members of my family are also applying for permanent resident status: (i) JAGATRAI (iv) MOHAN (vii) USHA (ii) SARASWATI (v) HARISH (iii) GOBIND (V1) VISHNU 8. I have have not heretofore filed an application for the status of a permanent resident. (If you have ever filed such application, give the date and place of filing and final disposition.) Form I-485 (Rev. 7-1-70)N UNITED STATES DEPARTMENT OF JUSTICE Immigration and Natural ization Service (Page 1) Received Ret' 8 9.72"
}