{
  "id": "A19529822_0050",
  "page_index": 50,
  "resources": {
    "full_jpg": "https://dctn4zjpwgdwdiiy5odjv7o2se0bqgjb.lambda-url.us-east-1.on.aws/iiif/3/og-2023-kc-nara_A19529822_0050/full/max/0/default.jpg",
    "ocr_txt": true
  },
  "fields": {
    "sex": {
      "ms_sex_llm_v1": "female"
    },
    "doctype": {
      "ms_doctype_v1": "form"
    },
    "form_title": {
      "ms_form_title_llm_v1": "Biographic Information, FORM G-325A ( (REV. 4-1-71)"
    },
    "is_g325a": true,
    "is_cert_naturalization": false,
    "countries": {
      "ms_countries_nlp_v1": [
        "Peru",
        "Pakistan",
        "United States",
        "India"
      ]
    },
    "years": {
      "ms_years_nlp_v1": [
        1962,
        1972,
        1906,
        2023,
        1926
      ]
    },
    "g325a": {
      "occupation": {
        "occupation_llm_v1": "['housewife', ' none']"
      },
      "nationality": {
        "nationality_llm_v1": "INDIAN"
      }
    }
  },
  "anumber": "A19529822",
  "full_text": "Screened by NARA, 7/13/2023 code 0300 - NYO FORM G-325A (REV. 4-1-71) office Form-Approved UNITED STATES DEPARTMENT OF JUSTICE Budget Bureay No.143-R436 BIOGRAPHIC Immigration and Naturalization Service 245 e 0830 Sec. INFORMATION (Family name) (First name) (Middle name) MALE BIRTHDATE (Mo.-Day-Yr.) NATIONALITY ALIEN REGISTRATION NO. WADHWANI DURYPADI JAGAT FEMALE 11/28/1906 INDIAN H19529824 (If any ALL OTHER NAMES USED -RAI CITY AND COUNTRY OF BIRTH SOCIAL SECURITY NO. BHAGWANANI ISAR KARACHI, WEST PAKISTAN (If any) - FAMILY NAME FIRST NAME DATE, CITY AND COUNTRY OF BIRTH (If known) CITY AND COUNTRY OF RESIDENCE FATHER BHAGWANANI MULRAJ - WEST \" PAKISTAN} \" DECEASE D MOTHER (Maiden name) BHAMBHANI GAYA - HUSBAND (If none, so state) FAMILY NAME FIRST NAME BIRTHDATE CITY & COUNTRY OF BIRTH DATE OF MARRIAGE PLACE OF MARRIAGE OR (For wife, give maiden name) WIFE JAGAT SUKKUR WADHWANI -RAI 11/5/1906 WEST PAKISTAN 4/17/1926 KHAIRPUR WEST PAK FORMER HUSBANDS OR WIVES (if none, so state) FAMILY NAME (For wife, give maiden name) FIRST NAME BIRTHDATE DATE & PLACE OF MARRIAGE DATE AND PLACE OF TERMINATION OF MARRIAGE NONE APPLICANT'S RESIDENCE LAST FIVE YEARS. LIST PRESENT ADDRESS FIRST. FROM TO STREET AND NUMBER CITY PROVINCE OR STATE COUNTRY MONTH YEAR MONTH YEAR . 18K PERU, 97/11 HORACE LAFRAK N.Y. U.S.A. July 1972 PRESENT TIME HARDING EXPWY N.Y.CITY 2 203 SKYLINE DRIVE CALIFORNIA PA. U.S.A APRIL 1972 JUNE 1972 3 RAJAWADI ROAD GHATKOPAR MAHARASH INDIA NOV. 1962 APRIL 1972 A-19/76 BOMBAY -TRA Show below last foreign residence of more than one year if not shown above. (Include all information requested above.) - APPLICANT'S EMPLOYMENT LAST FIVE YEARS. (IF NONE, SO STATE.) LIST PRESENT EMPLOYMENT FIRST. FROM TO FULL NAME AND ADDRESS OF EMPLOYER OCCUPATION (SPECIFY) MONTH YEAR MONTH YEAR NONE PRESENT TIME my House - Wife 4 all been life Show below last occupation abroad if not shown above. (Include all information requested above.) THIS FORM IS SUBMITTED IN CONNECTION WITH APPLICATION FOR: SIGNATURE OF APPLICANT OR PETITIONER DATE Z NATURALIZATION ADJUSTMENT OF STATUS OTHER (SPECIFY): 43 IF YOUR NATIVE ALPHABET IS IN OTHER THAN ROMAN LETTERS WRITE YOUR NAME IN YOUR NATIVE ALPHABET IN THIS SPACE: Are all copies legible? Yes PENALTIES: SEVERE PENALTIES ARE PROVIDED BY LAW FOR KNOWINGLY AND WILLFULLY FALSIFYING OR CONCEALING A MATERIAL FACT."
}