{
  "anumber": "A21200457",
  "id": "A21200457_0022",
  "page_index": 22,
  "resources": {
    "full_jpg": "https://dctn4zjpwgdwdiiy5odjv7o2se0bqgjb.lambda-url.us-east-1.on.aws/iiif/3/og-2023-kc-nara_A21200457_0022/full/max/0/default.jpg"
  },
  "fields": {
    "sex": {
      "ms_sex_llm_v1": "male"
    },
    "doctype": {
      "ms_doctype_v1": "form"
    },
    "form_title": {
      "ms_form_title_llm_v1": "APPLICATION BY INDOCHINESE REFUGEE FOR PERMANENT RESIDENCE"
    },
    "countries": {
      "ms_countries_nlp_v1": [
        "Cambodia",
        "Vietnam",
        "United States",
        "Laos"
      ]
    },
    "years": {
      "ms_years_nlp_v1": [
        1975,
        1979,
        2023,
        1977,
        1915
      ]
    }
  },
  "is_g325a": false,
  "is_cert_naturalization": false,
  "full_text": "Screened by NARA, 8/17/2023 Form Approved APPLICATION BY INDOCHINESE REFUGEE FOR PERMANENT RESIDENCE OMB No. 43-R0595 DATE RECEIVED File Number Applicant for benefits of Section 101 of the Act of October 28, 1977 Section 103 of the Act of October 28, 1977 Section 104 of the Act of October 28, 1977 DO NOT WRITE ABOVE THIS LINE. SEE INSTRUCTIONS BEFORE FILLING IN APPLICATION. IF YOU NEED MORE SPACE TO ANSWER FULLY ANY QUESTION ON THIS FORM, USE A SEPARATE SHEET AND IDENTIFY EACH ANSWER WITH THE NUMBER OF THE CORRESPONDING QUESTION. PRINT IN BLOCK LETTERS COMPLETE ONLY ONE OF THE FOLLOWING (1A, 1B, OR 1C ): 1.A. I hereby apply to become a lawful permanent resident alien on the following basis: I am a native or citizen of Vietnam, Laos, or Cambodia and have been physically present in the United States for at least two years and: (1) was paroled into the United States as a refugee from those countries subsequent to March 31, 1975, but prior to January 1, 1979; or (2) was inspected and admitted or paroled into the United States on or before March 31, 1975, and was physically present in the United States on March 31, 1975. 1.B. I hereby apply to have my admission for permanent residence recorded as of March 31, 1975 or the date of my arrival in the United States, whichever date is later. I was lawfully admitted for permanent residence prior to October 28, 1977. I am a native or citizen of Vietnam, Laos, or Cambodia and I have been physically present in the United States for at least two years and I am the spouse minor unmarried child of a native or citizen of Vietnam, Laos, or Cambodia and such relationship existed on March 31, 1975 or the date upon which my spouse parent was inspected and admitted or paroled into the United States. 1.C. I hereby apply to become a lawful permanent resident alien on the following basis: I am not a native or citizen of Vietnam, Laos, or Cambodia but I have been physically present in the United States for at least two years and I am the spouse minor unmarried child of a native or citizen of Vietnam, Laos, or Cambodia and such relationship existed: (Check whichever date is later) on March 31, 1975, or the date on which my spouse or parent was paroled into the United States as a refugee. 2. My name is (Family Name) (First/Given Name) (Middle Name) SEX Male Female NEUYEN MiNH VAN 2A. Name which you were admitted to the United States (if different from above) 4. Have you ever applied for permanent res- idence status in the United States? 3. I reside in the United States at: (No. & Street) (Apt. No.) (City & State) (Zip Code) Yes No (If \"Yes\", give date and 138 KENT ROAD UPPER DARBY PA 19082 place of filing and final disposition.) 5. Alien registration No. 6. I am now a citizen of (Country) 7. Date of Birth A-21-200-4571 VIET NAM July 14 1915 8. Place of Birth (City or Town) (County, Province, or State) (Country) DAN TRANG AN THE HUNGYEN VIETNAM 9. Name as appears on nonimmigrant document Form My I-94 permit number is: I-94 NGVYEN VAN MiNH 10. My last arrival in the United States occurred on: 2 At the Port of (City, State) DATE: (Month, Day, Year) C 5 28 75 11. I arrived by (Name of vessel or other means of travel) as a (Visitor, student, U.S. citizen, stowaway, immigrant, parolee, etc.) MILITARY AirPLANE PAROLEE 12. I was was not 13. My nonimmigrant visa, number was issued by the U.S. Consul inspected on (Month, Day, Year) at (City, Country) 14. I have been married ONE times, including my present marriage, if now married. (If you are now married give the following) A. Number of times my husband or wife has been married. ONE B. Name of husband or wife (Wife's maiden name) PHAM THE VA C. My husband or wife resides with me apart from me at Address (Apt. No.) (No. & Street) (Town or City) (Province or State) (Country) 15. I have have not been absent from the United States during the past two years. FORM I-485 C RECEIVED TRANS. IN RET' TRANS. (Page 1) OUT COMPLETED (10-15-77) 4-13/78 4-13-78"
}