{
  "anumber": "A21200457",
  "id": "A21200457_0025",
  "page_index": 25,
  "resources": {
    "full_jpg": "https://dctn4zjpwgdwdiiy5odjv7o2se0bqgjb.lambda-url.us-east-1.on.aws/iiif/3/og-2023-kc-nara_A21200457_0025/full/max/0/default.jpg"
  },
  "fields": {
    "sex": {
      "ms_sex_llm_v1": "male"
    },
    "doctype": {
      "ms_doctype_v1": "form"
    },
    "form_title": {
      "ms_form_title_llm_v1": "BIOGRAPHIC INFORMATION, G-325A ( (REV. 10-1-74) Y"
    },
    "countries": {
      "ms_countries_nlp_v1": [
        "Vietnam",
        "United States"
      ]
    },
    "years": {
      "ms_years_nlp_v1": [
        1975,
        1974,
        1955,
        1913,
        1933,
        1977,
        1978,
        1965
      ]
    },
    "g325a": {
      "occupation": {
        "occupation_llm_v1": "[' budget', ' examinator', 'government']"
      },
      "reason": {
        "reason_llm_v1": "NATURALIZATION"
      },
      "nationality": {
        "nationality_llm_v1": "VIETNAM"
      }
    }
  },
  "is_g325a": true,
  "is_cert_naturalization": false,
  "full_text": "creened by NARA, 8/17/202 FORM G-325A (REV. 10-1-74) Y Form Approved UNITED STATES DEPARTMENT OF JUSTICE OMB No. 43-R436 Immigration and Naturalization Service BIOGRAPHIC APR 1 6 1978 INFORMATION (Family name) (First name) (Middle name) MALE BIRTHDATE(Mo.-Day-Yr.) NATIONALITY ALIEN REGISTRATION NO. NGVYEN MiNH VAN FEMALE 7/14/15 VIET NAM (If any) 521-200-457 ALL OTHER NAMES USED (Including names by previous marriages) CITY AND COUNTRY OF BIRTH SOCIAL SECURITY NO. DANTRANG ANTHI HUNGYEN vietNAm (If any) 1586-40-9958 FAMILY NAME FIRST NAME DATE, CITY AND COUNTRY OF BIRTH(If known) CITY AND COUNTRY OF RESIDENCE NGUYEN CHINH DRUTRANG HUNGYEN DANTRANG AN THE HUNGYEN Viet Man FATHER - id - MOTHER (Maiden name) QUACH KINH HUSBAND (If none, so state) FAMILY NAME FIRST NAME BIRTHDATE CITY & COUNTRY OF BIRTH DATE OF MARRIAGE PLACE OF MARRIAGE OR (For wife, give maiden name) WIFE VAC 8/22/1913 NHAT TAO ANTH 1/31/1933 NHATTAO PHAM HUNGYEN VIRTNAM AUNOYEN vietnam FORMER HUSBANDS OR WIVES(if none, so state) FAMILY NAME (For wife, give maiden name) FIRST NAME BIRTHDATE DATE & PLACE OF MARRIAGE DATE AND PLACE OF TERMINATION OF MARRIAGE NONE APPLICANT'S RESIDENCE LAST FIVE YEARS. LIST PRESENT ADDRESS FIRST. FROM TO STREET AND NUMBER CITY PROVINCE OR STATE COUNTRY MONTH YEAR MONTH YEAR 17 West HiLLCREST HAVERTOWN PENNSYLVANIA AmERicA PRESENT TIME 5 1975 4 1977 163 48 Street SAiGOU VIET NAM VIET NAM 5 1955 5 1975 APPLICANT'S LAST ADDRESS OUTSIDE THE UNITED STATES OF MORE THAN ONE YEAR FROM TO STREET AND NUMBER CITY PROVINCE OR STATE COUNTRY MONTH YEAR MONTH YEAR 163 48 Street SAIGON SAIGON VIET NAM 5 1955 5 1975 APPLICANT'S EMPLOYMENT LAST FIVE YEARS. (IF NONE, so STATE.) LIST PRESENT EMPLOYMENT FIRST. FROM TO FULL NAME AND ADDRESS OF EMPLOYER OCCUPATION (SPECIFY) MONTH YEAR MONTH YEAR PRESENT TIME GOURNMENT VIET NAM EXAMINATOR 6 1965 7 1974 BUDGET Show below last occupation abroad if not shown above. (Include all information requested above.) THIS FORM IS SUBMITTED IN CONNECTION WITH APPLICATION FOR: SIGNATURE OF APPLICANT OR PETITIONER DATE NATURALIZATION ADJUSTMENT OF STATUS 4/4/77 OTHER (SPECIFY): IF YOUR NATIVE ALPHABET IS IN OTHER THAN ROMAN LETTERS. WRITE YOUR NAME IN YOUR NATIVE ALPHABET IN THIS SPACE: Are all copies legible? Yes PENALTIES: SEVERE PENALTIES ARE PROVIDED BY LAW FOR KNOWINGLY AND WILLFULLY FALSIFYING OR CONCEALING A MATERIAL FACT."
}