{
  "id": "A22484466_0025",
  "page_index": 25,
  "resources": {
    "full_jpg": "https://dctn4zjpwgdwdiiy5odjv7o2se0bqgjb.lambda-url.us-east-1.on.aws/iiif/3/og-2023-kc-nara_A22484466_0025/full/max/0/default.jpg",
    "ocr_txt": true
  },
  "fields": {
    "sex": {
      "ms_sex_llm_v1": "female"
    },
    "doctype": {
      "ms_doctype_v1": "form"
    },
    "form_title": {
      "ms_form_title_llm_v1": "BIOGRAPHIC INFORMATION, G-325A"
    },
    "is_g325a": true,
    "is_cert_naturalization": false,
    "countries": {
      "ms_countries_nlp_v1": [
        "Thailand",
        "Vietnam",
        "China",
        "United States"
      ]
    },
    "years": {
      "ms_years_nlp_v1": [
        1896,
        1912,
        1935
      ]
    },
    "g325a": {
      "occupation": {
        "occupation_llm_v1": "['retired']"
      },
      "nationality": {
        "nationality_llm_v1": "Vietnamese"
      }
    }
  },
  "anumber": "A22484466",
  "full_text": "Form Approved OMB No. 43-R436 BIOGRAPHIC INFORMATION (Family name) (First name) (Middle name) MALE BIRTHDATE(Mo.-Day-Yr.) NATIONALITY ALIEN REGISTRATION NO. (If any) -TRAN, LIEN THI FEMALE 1896 Vietnamese A 122 484 466 ALL OTHER NAMES USED (Including names by previous marriages) CITY AND COUNTRY OF BIRTH SOCIAL SECURITY NO. Saigon, Vietnam (580)56-7200 none FAMILY NAME FIRST NAME DATE, CITY AND COUNTRY OF BIRTH(If known) CITY AND COUNTRY OF RESIDENCE FATHER Tran, Ky ? China Deceased MOTHER(Maiden name) Duong, Lua ? Vietnam Deceased HUSBAND (If none, so state) FAMILY NAME FIRST NAME BIRTHDATE CITY & COUNTRY OF BIRTH DATE OF MARRIAGE PLACE OF MARRIAGE OR (For wife, give maiden name) WIFE none FORMER HUSBANDS OR WIVES(if none,so state) FAMILY NAME (For wife, give maiden name) FIRST NAME BIRTHDATE DATE & PLACE OF MARRIAGE DATE AND PLACE OF TERMINATION OF MARRIAGE Huynh, Phan Phan 1884 1912-Saigon, Vietnam Deceased 1935 APPLICANT'S RESIDENCE LAST FIVE YEARS. LIST PRESENT ADDRESS FIRST. FROM TO STREET AND NUMBER CITY PROVINCE OR STATE COUNTRY MONTH YEAR MONTH YEAR 08 76 PRESENT TIME 26981 Ayamonte Mission Viejo Ca USA Thailand (Camp) 06 76 07 76 513 Hong Bang Saigon Vietnam 34 06 76 APPLICANT'S LAST ADDRESS OUTSIDE THE UNITED STATES OF MORE THAN ONE YEAR FROM TO STREET AND NUMBER CITY PROVINCE OR STATE COUNTRY MONTH YEAR MONTH YEAR 513 Hong Bang Saigon Vietnam 34 06 76 APPLICANT'S EMPLOYMENT LAST FIVE YEARS. (IF NONE, SO STATE.) LIST PRESENT EMPLOYMENT FIRST. FROM TO FULL NAME AND ADDRESS OF EMPLOYER YEAR MONTH none OCCUPATION (SPECIFY) MONTH YEAR PRESENT TIME Show below last occupation abroad if not shown above. (Include all information requested above.) none THIS FORM IS SUBMITTED IN CONNECTION WITH APPLICATION FOR: SIGNATURE OF APPLICANT OR PETITIONER DATE NATURALIZATION ADJUSTMENT OF STATUS OTHER (SPECIFY): IF YOUR NATIVE ALPHABET IS IN OTHER THAN ROMAN LETTERS. WRITE YOUR NAME IN YOUR NATIVE ALPHABET IN THIS SPACE: Are all copies legible? Yes PENALTIES SEVERE PENALTIES ARE PROVIDED BY LAW FOR KNOWINGLY AND WILLFULLY FALSIFYING OR CONCEALING A MATERIAL FACT. APPLICANT: BE SURE TO PUT YOUR NAME AND ALIEN REGISTRATION NUMBER IN THE BOX OUTLINED BY HEAVY BORDER BELOW. COMPLETE THIS BOX (Family name) (Given name) (Middle name) (Alien registration number) TRAN, LIEN HI A 22 484 466 (OTHER AGENCY USE) INS USE (Office of Origin) OFFICE CODE: TYPE OF CASE: DATE: (3) C. FORM G-325A"
}