{
  "anumber": "A26875947",
  "id": "A26875947_0154",
  "page_index": 154,
  "resources": {
    "full_jpg": "https://dctn4zjpwgdwdiiy5odjv7o2se0bqgjb.lambda-url.us-east-1.on.aws/iiif/3/og-2023-kc-nara_A26875947_0154/full/max/0/default.jpg"
  },
  "fields": {
    "sex": {
      "ms_sex_llm_v1": "male"
    },
    "doctype": {
      "ms_doctype_v1": "form"
    },
    "form_title": {
      "ms_form_title_llm_v1": "U.S. Department of Justice Immigration and Naturalization Service, G-325A"
    },
    "countries": {
      "ms_countries_nlp_v1": [
        "Haiti",
        "United States"
      ]
    },
    "years": {
      "ms_years_nlp_v1": [
        1905,
        2023,
        1938,
        1913
      ]
    },
    "g325a": {
      "occupation": {
        "occupation_llm_v1": "['n.a']"
      },
      "reason": {
        "reason_llm_v1": "NATURALIZATION"
      },
      "nationality": {
        "nationality_llm_v1": "haiti"
      }
    }
  },
  "is_g325a": true,
  "is_cert_naturalization": false,
  "full_text": "Screened by NARA. 8/11/2023 U.S. Department of Justice FORM G-325A OMB No. 1115-0066 Immigration and Naturalization Service BIOGRAPHIC INFORMATION Approval expires 4-30-85 (Family name) (First name) (Middle name) MALE BIRTHDATE(Mo.-Day-Yr.) NATIONALITY FILE NUMBER PETIT ROSEGARCON FEMALE 12-01-1905 HAiti A26 875 947 ALL OTHER NAMES USED (Including names by previous marriages) CITY AND COUNTRY OF BIRTH SOCIAL SECURITY NO. QUARTIEN MOVIN HAITI (If any) FAMILY NAME FIRST NAME DATE, CITY AND COUNTRY OF BIRTH(If known) CITY AND COUNTRY OF RESIDENCE Artn PIERRE PAUL The JEESIUS PERCE HAITI FATHER <<<<< MOTHER (Maiden name) PIECRE JEANCILIA 1) HUSBAND (If none, so state) FAMILY NAME FIRST NAME BIRTHDATE CITY & COUNTRY OF BIRTH DATE OF MARRIAGE PLACE OF MARRIAGE OR (For wife, give maiden name) WIFE 1913 PEtiT GrandJEAN 03-05- CAP- HAITI 07-30-1938 QUArtiEr MOSIN FORMER HUSBANDS OR WIVES(if none,so state) FAMILY NAME (For wife, give maiden name) FIRST NAME BIRTHDATE DATE & PLACE OF MARRIAGE DATE AND PLACE OF TERMINATION OF MARRIAGE APPLICANT'S RESIDENCE LAST FIVE YEARS. LIST PRESENT ADDRESS FIRST. FROM TO STREET AND NUMBER CITY PROVINCE OR STATE COUNTRY MONTH YEAR MONTH YEAR Run BEE CALIFORNIA Histor PRESENT TIME 48 FULLEY st. Drch. MA USA 12 84 Rue 18K CAP HAitian HAITI OVER 5year. APPLICANT'S LAST ADDRESS OUTSIDE THE UNITED STATES OF MORE THAN ONE YEAR FROM TO STREET AND NUMBER CITY PROVINCE OR STATE COUNTRY MONTH YEAR MONTH YEAR APPLICANT'S EMPLOYMENT LAST FIVE YEARS. (IF NONE. so STATE.) LIST PRESENT EMPLOYMENT FIRST FROM TO FULL NAME AND ADDRESS OF EMPLOYER OCCUPATION (SPECIFY) MONTH YEAR MONTH YEAR PRESENT TIME Show below last occupation abroad if not shown above. (Include all information requested above.) THIS FORM IS SUBMITTED IN CONNECTION WITH APPLICATION FOR: SIGNATURE OF APPLICANT DATE NATURALIZATION STATUS AS PERMANENT RESIDENT OTHER (SPECIFY): Rose Jascon THAN ROMAN LETTERS. Lett WRITE 5-15-85 IF YOUR NATIVE ALPHABET IS IN OTHER YOUR NAME IN YOUR NATIVE ALPHABET IN THIS SPACE: Are all copies legible? Yes PENALTIES: SEVERE PENALTIES ARE PROVIDED BY LAW FOR KNOWINGLY AND WILLFULLY FALSIFYING OR CONCEALING A MATERIAL FACT. APPLICANT: BE SURE TO PUT YOUR NAME AND ALIEN REGISTRATION NUMBER IN THE BOX OUTLINED BY HEAVY BORDER BELOW. COMPLETE THIS BOX (Family name) (Given name) (Middle name) (Alien registration number) PEtit OSEGARCON FILE A26-875-947 Form G-325 A (Rev. 10-1-82) (1) Ident."
}