{
  "anumber": "A28068003",
  "id": "A28068003_0031",
  "page_index": 31,
  "resources": {
    "full_jpg": "https://dctn4zjpwgdwdiiy5odjv7o2se0bqgjb.lambda-url.us-east-1.on.aws/iiif/3/og-2023-kc-nara_A28068003_0031/full/max/0/default.jpg"
  },
  "fields": {
    "doctype": {
      "ms_doctype_v1": "form"
    },
    "form_title": {
      "ms_form_title_llm_v1": "Professional Certified Opinion"
    },
    "countries": {
      "ms_countries_nlp_v1": [
        "United States"
      ]
    },
    "years": {
      "ms_years_nlp_v1": [
        2023
      ]
    }
  },
  "is_g325a": false,
  "is_cert_naturalization": false,
  "full_text": "Screened by NARA, 4/24/2023 Applicant's Name Alien Registration Number HAWA HERSi A28068003 Professional Certified Opinion The law requires that in order to be eligible for the disability exception, the applicant must be unable to fulfill the English and civics testing requirements for naturalization. An applicant's difficulty in fulfilling the requirements, such as illiteracy in his or her native language, is not sufficient by itself to support a finding of eligibility for the exception. 11. ENGLISH REQUIREMENT In your professional medical opinion, based on your examination of the applicant, the applicant's symptoms, previous medical records, clinical findings, or tests: (a) Does the applicant have any disability or impairment that affects his or her ability to function to such a degree that he or she is unable to learn and demonstrate an ability to speak, read, or write English? Yes No (b) If \"Yes,\" which of the following is the applicant unable to learn and demonstrate? (Check all that apply.) Speaking Reading Writing 12. U.S. HISTORY AND CIVICS REQUIREMENT In your professional medical opinion, based on your examination of the applicant, the applicant's symptoms, previous medical records, clinical findings, or tests, does the applicant have any disability or impairment(s) that affects his or her ability to function to such a degree that he or she is unable to learn and demonstrate knowledge of U.S. history and civics, even in a language the applicant understands? error JasPoro Yes No SK NOTE: If you answered \"No\" to BOTH items 11(a) and (12), the applicant is ineligible for a disability exception. Sign the \"Medical Professional's Certification\" below. MEDICAL PROFESSIONAL'S CERTIFICATION I certify, under penalty of perjury under the laws of the United States of America, that the information on this form and any evidence submitted with it are all true and correct. The applicant having consented in Part I to the release of his or her relevant medical records to U.S. Citizenship and Immigration Services, I will furnish such records, if requested by that agency. I am aware that the knowing placement of false information on Form N-648 and related documents may also subject me to criminal penalties under Title 18, U.S.C.1546 and civil penalties under Title 8, U.S.C.1324c. I certify that I have verified the applicant's identity through the following United States or State government-issued photographic identity document: Medicae Cord, + green card Licensed Medical Professional's Signature Date One 11/13/09 Form N-648 (Rev. 07/01/09) Y Page 5"
}