{
  "anumber": "A28871610",
  "id": "A28871610_0002",
  "page_index": 2,
  "resources": {
    "full_jpg": "https://dctn4zjpwgdwdiiy5odjv7o2se0bqgjb.lambda-url.us-east-1.on.aws/iiif/3/og-2023-kc-nara_A28871610_0002/full/max/0/default.jpg"
  },
  "fields": {
    "sex": {
      "ms_sex_llm_v1": "male"
    },
    "doctype": {
      "ms_doctype_v1": "form"
    },
    "form_title": {
      "ms_form_title_llm_v1": "U.S. Department of Justice Immigration and Naturalization Service, G-325A"
    },
    "countries": {
      "ms_countries_nlp_v1": [
        "Guatemala",
        "Nicaragua"
      ]
    },
    "years": {
      "ms_years_nlp_v1": [
        1988,
        2023,
        1932
      ]
    },
    "g325a": {
      "occupation": {
        "occupation_llm_v1": "[' retired', 'political asylum']"
      },
      "reason": {
        "reason_llm_v1": "POLITICAL ASYLUM"
      },
      "nationality": {
        "nationality_llm_v1": "NICARAGUA"
      }
    }
  },
  "is_g325a": true,
  "is_cert_naturalization": false,
  "full_text": "Screened by NARA, 6/8/2023 U.S. GPO 1988-199-536 For sale by the Superintendent of Documents, U.S. Government Printing Office Washington, D.C. 20402 (Per 100) FORM G-325A U.S. Department of Justice OMB No. 1115-0066 Immigration and Naturalization Service BIOGRAPHIC INFORMATION (Family name) (First name) (Middle name) MALE BIRTHDATE(Mo.-Day-Yr.) NATIONALITY FILE NUMBER HERNANDEZ LUIS FELIPE FEMALE 12-20-14 NICARAGUAN A CITY AND COUNTRY OF BIRTH SOCIAL SECURITY NO. ALL OTHER NAMES USED (Including names by previous marriages) (If any) LUIS FELIPE HERNANDEZ PALACIOS JINOTEGA, NICARAGUA FAMILY NAME FIRST NAME DATE, CITY AND COUNTRY OF BIRTH(If known) CITY AND COUNTRY OF RESIDENCE HERNANDEZ, PRUDENCIO (DECEASED) FATHER MOTHER(Maiden name) PALACIOS, FELIPA (DECEASED) HUSBAND (If none, so state) FAMILY NAME FIRST NAME BIRTHDATE CITY & COUNTRY OF BIRTH DATE OF MARRiAGE PLACE OF MARRIAGE OR (For wife, give maiden name) WIFE JINOTEGA, JINOTEGA PICADO, CLEMENCIA 11-23-16 NICARAGUA 05-14-1932 NICARAGUA FORMER HUSBANDS OR WIVES(if none, so state) FAMILY NAME (For wife, give maiden name) FIRST NAME BIRTHDATE DATE & PLACE OF MARRIAGE DATE AND PLACE OF TERMINATION OF MARRIAGE N/A FROM TO APPLICANT'S RESIDENCE LAST FIVE YEARS. LIST PRESENT ADDRESS FIRST. PROVINCE OR STATE COUNTRY MONTH YEAR MONTH YEAR STREET AND NUMBER CITY FLORIDA U. S.A. 02 87 PRESENT TIME 1770 N. W. 21nd TERRACE MIAMI 8 CALLE B-3260, ZONA 7. COL.C.AMERICA GUATEMALA GUATEMALA GUATEMALA 10 84 10 87 DE LA TEXACO 3 C. AL NORTE MANAGUA MANAGUA NICARAGUA 10 82 10 84 APPLICANT'S LAST ADDRESS OUTSIDE THE UNITED STATES OF MORE THAN ONE YEAR FROM TO STREET AND NUMBER PROVINCE OR STATE COUNTRY MONTH YEAR MONTH YEAR CITY 8 CALLE B-3260, ZONA 7, COL C.AMERICA GUATEMALA GUATEMALA GUATEMALA 10 86 10 87 APPLICANT'S EMPLOYMENT LAST FIVE YEARS. (IF NONE, so STATE.) LIST PRESENT EMPLOYMENT FIRST FROM TO OCCUPATIONISPECIFY) MONTH YEAR MONTH YEAR FULL NAME AND ADDRESS OF EMPLOYER IN NICARAGUA I WORKED BY MYSELF WITH A GARAGE FOR CARS AND A SUPPLY PRESENT TIME OF PROVISIONS. IN GUATEMALA I WORKED BY MYSELF Show below last occupation abroad if not shown above. (Include all information requested above.) I WORKED BY MYSELF WITH MY OWN KIND OF BUSINESS AS MERCHANT DATE THIS FORM IS SUBMITTED IN CONNECTION WITH APPLICATION FOR: SIGNATURE OF APPLICANT NATURALIZATION STATUS AS PERMANENT RESIDENT OTHER (SPECIFY): POLITICAL ASYLUM Tijuk JUNE 30, 1988. IF YOUR NATIVE-ALPHANE 16 IN OTHER THAN ROMAN LETTERS. WRITE YOUR NAME IN TOUR NATIVE ALPHABET IN THIS SPACE: Are all copies legible? Yes PENALTIES: SEVERE PENALTIES ARE PROVIDED BY LAW FOR KNOWINGLY AND WILLFULLY FALSIFYING OR CONCEALING A MATERIAL FACT. APPLICANT: BE SURE TO PUT YOUR NAME AND ALIEN REGISTRATION NUMBER IN THE BOX OUTLINED BY HEAVY BORDER BELOW. COMPLETE THIS BOX (Family name) (Given name) (Middle name) (Alien registration number) HERNANDEZ LUIS FELIPE"
}