{
  "anumber": "A34190657",
  "id": "A34190657_0013",
  "page_index": 13,
  "resources": {
    "full_jpg": "https://dctn4zjpwgdwdiiy5odjv7o2se0bqgjb.lambda-url.us-east-1.on.aws/iiif/3/og-2023-kc-nara_A34190657_0013/full/max/0/default.jpg"
  },
  "fields": {
    "sex": {
      "ms_sex_llm_v1": "female"
    },
    "doctype": {
      "ms_doctype_v1": "form"
    },
    "form_title": {
      "ms_form_title_llm_v1": "U.S. Department of Justice Immigration and Naturalization Service BIOGRAPHIC INFORMATION, G-325 ( (Rev. 10-1-82) Y"
    },
    "countries": {
      "ms_countries_nlp_v1": [
        "China",
        "United States"
      ]
    },
    "years": {
      "ms_years_nlp_v1": [
        1876,
        1960,
        1981,
        1986,
        1973,
        1980,
        2023,
        1878
      ]
    },
    "g325a": {
      "occupation": {
        "occupation_llm_v1": "['retired']"
      },
      "reason": {
        "reason_llm_v1": "NATURALIZATION"
      },
      "nationality": {
        "nationality_llm_v1": "China"
      }
    }
  },
  "is_g325a": true,
  "is_cert_naturalization": false,
  "full_text": "Screened by NARA, 9/25/2023 U.S. Department of Justice OMB No. 1115-0066 Immigration and Naturalization Service BIOGRAPHIC INFORMATION UILL (Family name) (First name) (Middle name) MALE BIRTHDATE (Mo.-Day-Yr.) NATIONALITY FILE NUMBER 60.00 CHIANG Shu Tung FEMALE 8/17/11 China A 34-190-657 ALL OTHER NAMES USED (Including names by previous marriages) CITY AND COUNTRY OF BIRTH SOCIAL SECURITY NO. S. T. Chiang Soochow City, China (If any) 563-31-4696 FAMILY NAME FIRST NAME DATE, CITY AND COUNTRY OF BIRTH (If known) CITY AND COUNTRY OF RESIDENCE. CHIANG Li FATHER 10/2/1878 Soochow, China Deceased MOTHER (Maiden name) Koo Chin 5/20/1876 11 \" 11 HUSBAND (Ifrione, so state) FAMILY NAME FIRST NAME BIRTHDATE CITY & COUNTRY OF BIRTH DATE OF MARRIAGE PLACE OF MARRIAGE OR (For wife, give maiden name) WIFE Lo Kwei 8/23/15 Kweilin, China 12/24/37 Shanghai FORMER HUSBANDS OR WIVES (if none, so state) None FAMILY NAME (For wife, give maiden name) FIRST NAME BIRTHDATE DATE & PLACE OF MARRIAGE DATE AND PLACE OF TERMINATION OF MARRIAGE APPLICANT'S RESIDENCE LAST FIVE YEARS. LIST PRESENT ADDRESS FIRST. FROM TO STREET AND NUMBER CITY PROVINCE OR STATE COUNTRY MONTH YEAR MONTH YEAR 3910 Via Verde Thousand Oaks, CA. U.S.A. 7 1986 PRESENT TIME 3931 Via Verde 11 11 11 â‘‰ 5 1980 7 986 APPLICANT'S LAST ADDRESS OUTSIDE THE UNITED STATES OF MORE THAN ONE YEAR FROM TO STREET AND NUMBER CITY PROVINCE OR STATE COUNTRY MONTH YEAR MONTH YEAR 37 Jen Ai Rd., Section 4 Taipei Taiwan China 3 1973 6 988 APPLICANT'S EMPLOYMENT LAST FIVE YEARS. (IF NONE, so STATE) LIST PRESENT EMPLOYMENT FIRST FROM TO FULL NAME AND ADDRESS OF EMPLOYER OCCUPATION (SPECIFY) MONTH YEAR MONTH YEAR Retired Accountant 9 1981 PRESENT TIME Chiang, Lai, Lin & Co. Partner 6 1960 6 988 106 Kuang Fu S. Road, Taipei, Taiwan Show below last occupation abroad if not shown above. (Include all information requested above.) THIS FORM IS SUBMITTED IN CONNECTION WITH APPLICATION FOR: SIGNATURE OF DATE NATURALIZATION OTHER (SPECIFY): STATUS AS PERMANENT RESIDENT APPLICANT Shirthing 1/25/91 IF YOUR NATIVE ALPHABET IS IN OTHER THAN ROMAN LETTERS, WRITE YOUR NAME IN YOUR NATIVE ALPHABET IN THIS SPACE: Are all copies legible? Yes PENALTIES: SEVERE PENALTIES ARE PROVIDED BY LAW FOR KNOWINGLY AND WILLFULLY FALSIFYING OR CONCEALING A MATERIAL FACT. APPLICANT: BE SURE TO PUT YOUR NAME AND ALIEN REGISTRATION NUMBER IN THE BOX OUTLINED BY HEAVY BORDER BELOW. COMPLETE THIS BOX (Family name) (Given name) (Middle name) (Allen registration number) CHIANG Shu Tung A34-190-657 (OTHER AGENCY USE) INS USE (Office of Origin) OFFICE CODE: TYPE OF CASE: DATE: Form G-325 (Rev. 10-1-82) Y (2) Rec. BR."
}