{
  "anumber": "A34190657",
  "id": "A34190657_0000",
  "page_index": 0,
  "resources": {
    "full_jpg": "https://dctn4zjpwgdwdiiy5odjv7o2se0bqgjb.lambda-url.us-east-1.on.aws/iiif/3/og-2023-kc-nara_A34190657_0000/full/max/0/default.jpg"
  },
  "fields": {
    "sex": {
      "ms_sex_llm_v1": "male"
    },
    "doctype": {
      "ms_doctype_v1": "letter"
    },
    "form_title": {
      "ms_form_title_llm_v1": "U.S. Naturalization Certificate, FORM N-550 ( (REV. 11-1-87)Y"
    },
    "countries": {
      "ms_countries_nlp_v1": [
        "China",
        "United States"
      ]
    },
    "years": {
      "ms_years_nlp_v1": [
        2023,
        1911,
        1991
      ]
    },
    "certificate_naturalization": {
      "complexion": {
        "complexion_llm_v1": "medium"
      },
      "marital_status": {
        "marital_status_llm_v1": "MARRIED"
      },
      "year_naturalization": {
        "year_naturalization_llm_v1": 1991.0
      },
      "residence_naturlization": {
        "residence_naturlization_llm_v1": "THOUSAND OAKS, CA"
      }
    }
  },
  "is_g325a": false,
  "is_cert_naturalization": true,
  "full_text": "FORM N-550 Screened by NARA, 9/25/2023 No. 14732274 U. S. DEPARTMENT OF JUSTICE IMMIGRATION AND NATURALIZATION SERVICE (REV. 11-1-87)Y Name SHU-TUNG CHIANG residing at 3910. VIA VERDE THOUSAND OAKS, CA. 91360 SIGNATURE OF HOLDER Date of birth 8/17/11 Date of order of admission 10/10/91 IS NOT REQUIRED ON THIS DUPLICATE STUB Date certificate issued OCTOBER 10TH, 1991 by the U.S. District Court at Los Angeles, California DUPLICATE DO NOT DETACH Petition No. 00.883844 INS Registration No. A34. 190. : E. 8.50 Chiang TO BE FORWARDED TO No. 14732274 IMMIGRATION AND INATURALIZATION SERVICE 0 Petition No. 00883844 DUPLICATE INS Registration Re A34 190 657 Personal description, of holderus, Date of birth AUGUST 17, 1911 isea MALE ; complexion MEDIUM coloropeyes BROWN color of hair GRAY height 5 feet 5 inches; weight 110 pounds, visible edistendive marks NONE Maritalstatus MARRIED Country of formernationality CHINA, MAINLAND I certify that the description, above givenis, drive, heretois, a likeness of me. Shoe Chiang / Complete and true signature of holder) UNITED STATES OF AMERICA CENTRAL DIST. OF CALIFORNIA } SS: Beit known, that alatermofthe District Court,of The United States held hursuantto, lawal Los Angeles on OCTOBER 10TH, 1991 SHU-TUNG CHIANG themresidingal 3910 VIA VERDE, THOUSAND OAKS, CA inlends loreside permanonWlyin, the United States when so required bythe Naturalization Laws ofthe United States), had in all otherrespects, complied with the applicant all provisions, of such naturalization laws, and was entilled lobe Seal admilledNoxilizenshe ih thereupon ordered that such person be and(s)howas admilled as a cilixen of the United States of America. Intestimony whereof thesealos, the courtis, 10TH day of OCTOBER menedeen/hundred.and NINETY-ONE LEONARD A. BROSNAN Clerk of the U.S. District Court. By Martha Solid Deputy Clerk. FORM N-550 (REV. 11-1-87)Y"
}