{
  "anumber": "A34190657",
  "id": "A34190657_0009",
  "page_index": 9,
  "resources": {
    "full_jpg": "https://dctn4zjpwgdwdiiy5odjv7o2se0bqgjb.lambda-url.us-east-1.on.aws/iiif/3/og-2023-kc-nara_A34190657_0009/full/max/0/default.jpg"
  },
  "fields": {
    "sex": {
      "ms_sex_llm_v1": "female"
    },
    "doctype": {
      "ms_doctype_v1": "form"
    },
    "form_title": {
      "ms_form_title_llm_v1": "Petition for Naturalization"
    },
    "countries": {
      "ms_countries_nlp_v1": [
        "United States"
      ]
    },
    "years": {
      "ms_years_nlp_v1": [
        1991,
        2023,
        1981,
        1986
      ]
    }
  },
  "is_g325a": false,
  "is_cert_naturalization": false,
  "full_text": "Screened by NARA, 9/25/2023 U.S. Department of Justice Application to File OMB #1115-0009 Immigration and Naturalization Service Petition for Naturalization This block for government use only. Section of Law Lr. Please read the instructions before filling out this form. e ructions 316 az 0280 001 004 02/01/91 16:57 N400 60.00 1. Your name (Exactly as it appears on your Alien Registration Receipt Card) 15. Place you were admitted for permanent residency (City and State) CHIANG, Shu-Tung Honolulu, Hawaii. TR5-5 3 2. Your Alien Registration Number 3. Your Social Security Number 16. Date your continuous residency began in the U.S. (Month/Day/Year) A-34-190-657 563-31-4696 3/30/73 4. Your name (Full true and correct name, if different from above) 17. How long have you continuously resided in the State where you now None Same an It live? (Number of Months) 45 months since 1986 5. Any other names you have used (Including maiden) 18. Do you intend to reside permanently in the United States? S. T. Chiang (If No, explain fully) Yes No 6. You may, by law, change your name at the time you are naturalized. If you wish to do so, please print or type that name below, or the name you want your certificate of naturalization issued under. CHIANG, Shu-Tung none 7. Your date of birth (Month/Day/Year) 8. Your Sex 8-17-11 Male Female 9. Your place of birth (City or Town) 19. Have you served in the United States Armed Forces? Soochow City (If Yes, complete all of #19.) Yes No (County, Province 95State) (Country) Branch of Service (Indicate if Reserve or National Guard) Kiangsu China None Inducted Enlisted 10. Was your father or mother ever a United States citizen? Location where you entered (City and State) (If Yes, explain fully) Yes No None Service began (Month/Day/Year) EG None Service ended (Month/Day/Year) None 33 11. Can you read and write English? Service number Pll Yes No None 12. Can you speak English? Rank at discharge Yes No None 13. Can you sign your name in English Type of discharge Yes No None 14. Date you were admitted for permanent residency (Month/Day/Year) Reason for discharge (Alienage, conscientious objector, other) 3-30-73 None 20. At what addresses in the United States have you lived during the last 5 years? List present address first. Street Address City, county and State From (Month/Day/Year) To (Month/Day/Year) 3910 Via Verde Thousand Oaks, CA. 7/14/86 Present 3931 Via Verde Thousand Oaks, CA. 5/2/80 7/14/86 the 4 21. What employment have you held during the last 5 years? List present or most recent employment first. (If none, write \"None\".) Name and Address of Employer Occupation or Type of Business From (Month/Day/Year) To (Month/Day/Year) None Retired States he has annuity and receives SocietSecurity -1981- Present worked for an American company babedim Tarison 6 FEB 0 6 1991 other Form N-400 (10/26/89) N"
}