[
  {
    "id": "A10712436_0021",
    "page_index": 21,
    "resources": {
      "full_jpg": "https://dctn4zjpwgdwdiiy5odjv7o2se0bqgjb.lambda-url.us-east-1.on.aws/iiif/3/og-2023-kc-nara_A10712436_0021/full/max/0/default.jpg",
      "ocr_txt": true
    },
    "fields": {
      "sex": {
        "ms_sex_llm_v1": "male"
      },
      "doctype": {
        "ms_doctype_v1": "form"
      },
      "form_title": {
        "ms_form_title_llm_v1": "Title: BIOGRAPHIC INFORMATION\\nForm Number: OMB No. 1115-0066"
      },
      "is_g325a": true,
      "is_cert_naturalization": false,
      "countries": {
        "ms_countries_nlp_v1": [
          "United States"
        ]
      },
      "g325a": {
        "occupation": {
          "occupation_llm_v1": "['n.a']"
        },
        "reason": {
          "reason_llm_v1": "NATURALIZATION"
        },
        "nationality": {
          "nationality_llm_v1": "Salvadoran"
        }
      }
    },
    "anumber": "A10712436",
    "full_text": "U.S. Department of Justice OMB No. 1115-0066 Immigration and Naturalization Service BIOGRAPHIC INFORMATION (Family name) (First name) (Middle name) MALE BIRTHDATE(Mo.-Day-Yr.) NATIONALITY FILE NUMBER Renderos Rosa Aminta FEMALE 2-28-13 SALVADOREAN 10 712 436 ALL OTHER NAMES USED (Including names by previous marriages) CITY AND COUNTRY OF BIRTH SOCIAL SECURITY NO. SAME NAHUIZALED EL SALVADOR C.A. 566-54-1023 (If. any) FAMILY NAME FIRST NAME DATE, CITY AND COUNTRY OF BIRTH(If known) CITY AND COUNTRY OF RESIDENCE. DominGuez RomuLo sonsonate, EL S a LV2DOR C.A. FATHER MOTHER(Maiden name) JuLiA CeLSA Renderos, same HUSBAND (If none, so state) FAMILY NAME FIRST NAME BIRTHDATE CITY & COUNTRY OF BIRTH DATE OF MARRIAGE PLACE OF MARRIAGE OR (For wife. give maiden name) WIFE none FORMER HUSBANDS OR WIVES (if none,so state) FAMILY NAME (For wife, give maiden name) FIRST NAME BIRTHDATE DATE & PLACE OF MARRIAGE DATE AND PLACE OF TERMINATION OF MARRIAGE APPLICANT'S RESIDENCE LAST FIVE YEARS. LIST PRESENT ADDRESS FIRST. FROM TO STREET AND NUMBER CITY PROVINCE OR STATE COUNTRY MONTH YEAR MONTH YEAR 11536 E. ImpERIaL Norwark CA. 12 79 PRESENT TIME APPLICANT'S LAST ADDRESS OUTSIDE THE UNITED STATES OF MORE THAN ONE YEAR FROM TO STREET AND NUMBER CITY PROVINCE OR STATE COUNTRY MONTH YEAR MONTH YEAR 13 C. OTe. 2-2 sonsonate EL SaLVaDor C 11 77 12 79 APPLICANT'S EMPLOYMENT LAST FIVE YEARS. (IF NONE, so STATE) LIST PRESENT EMPLOYMENT FIRST FROM TO FULL NAME AND ADDRESS OF EMPLOYER OCCUPATION (SPECIFY) MONTH YEAR MONTH YEAR none PRESENT TIME Show below last occupation abroad if not shown above. (Include all information requested above.) THIS FORM IS SUBMITTED IN CONNECTION WITH APPLICATION FOR: SIGNATURE OF APPLICANT DATE NATURALIZATION OTHER (SPECIFY): STATUS AS PERMANENT RESIDENT Rosal Aminta Renderos 4-18-88 IF YOUR NATIVE ALPHABET IS IN OTHER THAN ROMAN LETTERS. WRITE YOUR NAME IN YOUR NATIVE ALFNABET IN THIS SPACE: Are all copies legible? Yes PENALTIES: SEVERE PENALTIES ARE PROVIDED BY LAW FOR KNOWINGLY AND WILLFULLY FALSIFYING OR CONCEALING A MATERIAL FACT. APPLICANT: BE SURE TO PUT YOUR NAME AND ALIEN REGISTRATION NUMBER IN THE BOX OUTLINED BY HEAVY BORDER BELOW. COMPLETE THIS BOX (Family name) (Given name) (Middle name) (Alien registration number) Form G-325 (Rev. 10-1-82) Y (1) Ident."
  },
  {
    "id": "A10712436_0021",
    "page_index": 21,
    "resources": {
      "full_jpg": "https://dctn4zjpwgdwdiiy5odjv7o2se0bqgjb.lambda-url.us-east-1.on.aws/iiif/3/og-2023-kc-nara_A10712436_0021/full/max/0/default.jpg",
      "ocr_txt": true
    },
    "fields": {
      "sex": {
        "ms_sex_llm_v1": "male"
      },
      "doctype": {
        "ms_doctype_v1": "form"
      },
      "form_title": {
        "ms_form_title_llm_v1": "Title: BIOGRAPHIC INFORMATION\\nForm Number: OMB No. 1115-0066"
      },
      "is_g325a": true,
      "is_cert_naturalization": false,
      "countries": {
        "ms_countries_nlp_v1": [
          "United States"
        ]
      },
      "g325a": {
        "occupation": {
          "occupation_llm_v1": "['n.a']"
        },
        "reason": {
          "reason_llm_v1": "NATURALIZATION"
        },
        "nationality": {
          "nationality_llm_v1": "Salvadoran"
        }
      }
    },
    "anumber": "A10712436",
    "full_text": "U.S. Department of Justice OMB No. 1115-0066 Immigration and Naturalization Service BIOGRAPHIC INFORMATION (Family name) (First name) (Middle name) MALE BIRTHDATE(Mo.-Day-Yr.) NATIONALITY FILE NUMBER Renderos Rosa Aminta FEMALE 2-28-13 SALVADOREAN 10 712 436 ALL OTHER NAMES USED (Including names by previous marriages) CITY AND COUNTRY OF BIRTH SOCIAL SECURITY NO. SAME NAHUIZALED EL SALVADOR C.A. 566-54-1023 (If. any) FAMILY NAME FIRST NAME DATE, CITY AND COUNTRY OF BIRTH(If known) CITY AND COUNTRY OF RESIDENCE. DominGuez RomuLo sonsonate, EL S a LV2DOR C.A. FATHER MOTHER(Maiden name) JuLiA CeLSA Renderos, same HUSBAND (If none, so state) FAMILY NAME FIRST NAME BIRTHDATE CITY & COUNTRY OF BIRTH DATE OF MARRIAGE PLACE OF MARRIAGE OR (For wife. give maiden name) WIFE none FORMER HUSBANDS OR WIVES (if none,so state) FAMILY NAME (For wife, give maiden name) FIRST NAME BIRTHDATE DATE & PLACE OF MARRIAGE DATE AND PLACE OF TERMINATION OF MARRIAGE APPLICANT'S RESIDENCE LAST FIVE YEARS. LIST PRESENT ADDRESS FIRST. FROM TO STREET AND NUMBER CITY PROVINCE OR STATE COUNTRY MONTH YEAR MONTH YEAR 11536 E. ImpERIaL Norwark CA. 12 79 PRESENT TIME APPLICANT'S LAST ADDRESS OUTSIDE THE UNITED STATES OF MORE THAN ONE YEAR FROM TO STREET AND NUMBER CITY PROVINCE OR STATE COUNTRY MONTH YEAR MONTH YEAR 13 C. OTe. 2-2 sonsonate EL SaLVaDor C 11 77 12 79 APPLICANT'S EMPLOYMENT LAST FIVE YEARS. (IF NONE, so STATE) LIST PRESENT EMPLOYMENT FIRST FROM TO FULL NAME AND ADDRESS OF EMPLOYER OCCUPATION (SPECIFY) MONTH YEAR MONTH YEAR none PRESENT TIME Show below last occupation abroad if not shown above. (Include all information requested above.) THIS FORM IS SUBMITTED IN CONNECTION WITH APPLICATION FOR: SIGNATURE OF APPLICANT DATE NATURALIZATION OTHER (SPECIFY): STATUS AS PERMANENT RESIDENT Rosal Aminta Renderos 4-18-88 IF YOUR NATIVE ALPHABET IS IN OTHER THAN ROMAN LETTERS. WRITE YOUR NAME IN YOUR NATIVE ALFNABET IN THIS SPACE: Are all copies legible? Yes PENALTIES: SEVERE PENALTIES ARE PROVIDED BY LAW FOR KNOWINGLY AND WILLFULLY FALSIFYING OR CONCEALING A MATERIAL FACT. APPLICANT: BE SURE TO PUT YOUR NAME AND ALIEN REGISTRATION NUMBER IN THE BOX OUTLINED BY HEAVY BORDER BELOW. COMPLETE THIS BOX (Family name) (Given name) (Middle name) (Alien registration number) Form G-325 (Rev. 10-1-82) Y (1) Ident."
  },
  {
    "id": "A19529822_0050",
    "page_index": 50,
    "resources": {
      "full_jpg": "https://dctn4zjpwgdwdiiy5odjv7o2se0bqgjb.lambda-url.us-east-1.on.aws/iiif/3/og-2023-kc-nara_A19529822_0050/full/max/0/default.jpg",
      "ocr_txt": true
    },
    "fields": {
      "sex": {
        "ms_sex_llm_v1": "female"
      },
      "doctype": {
        "ms_doctype_v1": "form"
      },
      "form_title": {
        "ms_form_title_llm_v1": "Biographic Information, FORM G-325A ( (REV. 4-1-71)"
      },
      "is_g325a": true,
      "is_cert_naturalization": false,
      "countries": {
        "ms_countries_nlp_v1": [
          "Peru",
          "Pakistan",
          "United States",
          "India"
        ]
      },
      "years": {
        "ms_years_nlp_v1": [
          1962,
          1972,
          1906,
          2023,
          1926
        ]
      },
      "g325a": {
        "occupation": {
          "occupation_llm_v1": "['housewife', ' none']"
        },
        "nationality": {
          "nationality_llm_v1": "INDIAN"
        }
      }
    },
    "anumber": "A19529822",
    "full_text": "Screened by NARA, 7/13/2023 code 0300 - NYO FORM G-325A (REV. 4-1-71) office Form-Approved UNITED STATES DEPARTMENT OF JUSTICE Budget Bureay No.143-R436 BIOGRAPHIC Immigration and Naturalization Service 245 e 0830 Sec. INFORMATION (Family name) (First name) (Middle name) MALE BIRTHDATE (Mo.-Day-Yr.) NATIONALITY ALIEN REGISTRATION NO. WADHWANI DURYPADI JAGAT FEMALE 11/28/1906 INDIAN H19529824 (If any ALL OTHER NAMES USED -RAI CITY AND COUNTRY OF BIRTH SOCIAL SECURITY NO. BHAGWANANI ISAR KARACHI, WEST PAKISTAN (If any) - FAMILY NAME FIRST NAME DATE, CITY AND COUNTRY OF BIRTH (If known) CITY AND COUNTRY OF RESIDENCE FATHER BHAGWANANI MULRAJ - WEST \" PAKISTAN} \" DECEASE D MOTHER (Maiden name) BHAMBHANI GAYA - HUSBAND (If none, so state) FAMILY NAME FIRST NAME BIRTHDATE CITY & COUNTRY OF BIRTH DATE OF MARRIAGE PLACE OF MARRIAGE OR (For wife, give maiden name) WIFE JAGAT SUKKUR WADHWANI -RAI 11/5/1906 WEST PAKISTAN 4/17/1926 KHAIRPUR WEST PAK FORMER HUSBANDS OR WIVES (if none, so state) FAMILY NAME (For wife, give maiden name) FIRST NAME BIRTHDATE DATE & PLACE OF MARRIAGE DATE AND PLACE OF TERMINATION OF MARRIAGE NONE APPLICANT'S RESIDENCE LAST FIVE YEARS. LIST PRESENT ADDRESS FIRST. FROM TO STREET AND NUMBER CITY PROVINCE OR STATE COUNTRY MONTH YEAR MONTH YEAR . 18K PERU, 97/11 HORACE LAFRAK N.Y. U.S.A. July 1972 PRESENT TIME HARDING EXPWY N.Y.CITY 2 203 SKYLINE DRIVE CALIFORNIA PA. U.S.A APRIL 1972 JUNE 1972 3 RAJAWADI ROAD GHATKOPAR MAHARASH INDIA NOV. 1962 APRIL 1972 A-19/76 BOMBAY -TRA Show below last foreign residence of more than one year if not shown above. (Include all information requested above.) - APPLICANT'S EMPLOYMENT LAST FIVE YEARS. (IF NONE, SO STATE.) LIST PRESENT EMPLOYMENT FIRST. FROM TO FULL NAME AND ADDRESS OF EMPLOYER OCCUPATION (SPECIFY) MONTH YEAR MONTH YEAR NONE PRESENT TIME my House - Wife 4 all been life Show below last occupation abroad if not shown above. (Include all information requested above.) THIS FORM IS SUBMITTED IN CONNECTION WITH APPLICATION FOR: SIGNATURE OF APPLICANT OR PETITIONER DATE Z NATURALIZATION ADJUSTMENT OF STATUS OTHER (SPECIFY): 43 IF YOUR NATIVE ALPHABET IS IN OTHER THAN ROMAN LETTERS WRITE YOUR NAME IN YOUR NATIVE ALPHABET IN THIS SPACE: Are all copies legible? Yes PENALTIES: SEVERE PENALTIES ARE PROVIDED BY LAW FOR KNOWINGLY AND WILLFULLY FALSIFYING OR CONCEALING A MATERIAL FACT."
  },
  {
    "id": "A21203456_0009",
    "page_index": 9,
    "resources": {
      "full_jpg": "https://dctn4zjpwgdwdiiy5odjv7o2se0bqgjb.lambda-url.us-east-1.on.aws/iiif/3/og-2023-kc-nara_A21203456_0009/full/max/0/default.jpg",
      "ocr_txt": true
    },
    "fields": {
      "sex": {
        "ms_sex_llm_v1": "female"
      },
      "doctype": {
        "ms_doctype_v1": "form"
      },
      "form_title": {
        "ms_form_title_llm_v1": "United States Department of Justice Immigration and Naturalization Service, G-325A ( (REV. 10-1-74)"
      },
      "is_g325a": true,
      "is_cert_naturalization": false,
      "countries": {
        "ms_countries_nlp_v1": [
          "Vietnam",
          "United States"
        ]
      },
      "g325a": {
        "occupation": {
          "occupation_llm_v1": "['retired']"
        },
        "reason": {
          "reason_llm_v1": "OTHER"
        },
        "nationality": {
          "nationality_llm_v1": "VIETNAM"
        }
      }
    },
    "anumber": "A21203456",
    "full_text": "Carbons: If ty FORM G-325A (REV. 10-1-74) Y Form Approved UNITED STATES DEPARTMENT OF JUSTICE OMB No. 43-R436 Immigration and Naturalization Service BIOGRAPHIC INFORMATION (Family name) (First name) (Middle name) MALE BIRTHDATE(Mo.-Day-Yr.) NATIONALITY ALIEN REGISTRATION NO. TA VIEN THI FEMALE 12/01/85 VIETNAM (If any) A 21 - 203456 ALL OTHER NAMES USED (Including names by previous marriages) CITY AND COUNTRY OF BIRTH SOCIAL SECURITY NO. one FAMILY NAME FIRST NAME DATE, CITY AND COUNTRY OF BIRTH(If known) SON TAY , VIETNAM (If any) 586-328421 CITY AND COUNTRY OF RESIDENCE FATHER TA VAN HONG MOTHER (Maiden name) NGUYEN THE LAO VIETN NAM HUSBAND (If none, so state) FAMILY NAME FIRST NAME BIRTHDATE CITY & COUNTRY OF BIRTH DATE OF MARRIAGE PLACE OF MARRIAGE OR (For wife, give maiden name) WIFE PHAN Huy LIEU LIEU unk Vietnan Vulnant Deceased FORMER HUSBANDS OR WIVES( (if none;so state) FAMILY NAME (Fo wife, give maiden name) m/ FIRST NAME BIRTHDATE DATE & PLACE OF MARRIAGE DATE AND PLACE OF TERMINATION OF MARRIAGE APPLICANT'S RESIDENCE LAST FIVE YEARS. LIST PRESENT ADDRESS FIRST. FROM TO STREET AND NUMBER CITY PROVINCE OR STATE COUNTRY MONTH YEAR MONTH YEAR 927 centennial STF4 LOSANGELES C.A U.S.A 10 82 PRESENT TIME 1212 WATERLOO ST 10 81 10 82 827NBeAuDRy CA 10 77 10 81 25000 S. NORMAN DiE HARboRCiTy CA 10 75 10 77 APPLICANT'S LAST ADDRESS OUTSIDE THE UNITED STATES OF MORE THAN ONE YEAR FROM TO STREET AND NUMBER CITY PROVINCE OR STATE COUNTRY MONTH YEAR MONTH YEAR APPLICANT'S EMPLOYMENT LAST FIVE YEARS. (IF NONE, SO STATE.) LIST PRESENT EMPLOYMENT FIRST. FROM TO FULL NAME AND ADDRESS OF EMPLOYER OCCUPATION (SPECIFY) MONTH YEAR MONTH YEAR ReTiRED PRESENT TIME Too OCD Show below last occupation abroad if not shown above. (Include all information requested above.) THIS FORM IS SUBMITTED IN CONNECTION WITH APPLICATION FOR: SIGNATURE OF APPLICANT OR PETITIONER DATE NATURALIZATION ADJUSTMENT OF STATUS X 7-8-33 OTHER (SPECIFY): IF YOUR NATIVE ALPHABET IS IN OTHER THAN ROMAN LETTERS. WRITE YOUR NAME IN YOUR NATIVE ALPHABET IN THIS SPACE: Are all copies legible? Yes PENALTIES SEVERE PENALTIES ARE PROVIDED BY LAW FOR KNOWINGLY AND WILLFULLY FALSIFYING OR CONCEALING A MATERIAL FACT. APPLICANT: BE SURE TO PUT YOUR NAME AND ALIEN REGISTRATION NUMBER IN THE BOX OUTLINED BY HEAVY BORDER BELOW. COMPLETE THIS BOX (Family name) (Given name) (Middle name) (Alien registration number) TA VIEN THI A-21-203-456 (OTHER AGENCY USE) INS USE (Office of Origin) OFFICE CODE: TYPE OF CASE: DATE: FORM G-325A (1) Ident."
  },
  {
    "id": "A21203456_0014",
    "page_index": 14,
    "resources": {
      "full_jpg": "https://dctn4zjpwgdwdiiy5odjv7o2se0bqgjb.lambda-url.us-east-1.on.aws/iiif/3/og-2023-kc-nara_A21203456_0014/full/max/0/default.jpg",
      "ocr_txt": true
    },
    "fields": {
      "sex": {
        "ms_sex_llm_v1": "female"
      },
      "doctype": {
        "ms_doctype_v1": "form"
      },
      "form_title": {
        "ms_form_title_llm_v1": "United States Department of Justice Immigration and Naturalization Service, FORM G-325A ( (REV. 8-27-72N)"
      },
      "is_g325a": true,
      "is_cert_naturalization": false,
      "countries": {
        "ms_countries_nlp_v1": [
          "Vietnam",
          "United States"
        ]
      },
      "years": {
        "ms_years_nlp_v1": [
          1970,
          1975
        ]
      },
      "g325a": {
        "occupation": {
          "occupation_llm_v1": "['n.a']"
        },
        "reason": {
          "reason_llm_v1": "Naturalization"
        },
        "nationality": {
          "nationality_llm_v1": "VN"
        }
      }
    },
    "anumber": "A21203456",
    "full_text": "FORM G-325A (REV. 8-27-72)N Form Approved UNITED STATES DEPARTMENT OF JUSTICE OMB No. 43-R436 Immigration and Naturalization Service BIOGRAPHIC INFORMATION (Family name) (First name) (Middle name) MALE BIRTHDATE(Mo.-Day-Yr. NATIONALITY ALIEN REGISTRATION NO. TA THI FEMALE 1385 VN (421) 203 456 (If any) ALL OTHER NAMES USED (Including names by previous marriages) CITY AND COUNTRY OF BIRTH SOCIAL SECURITY NO. SON TAY NVN (If any) FAMILY NAME FIRST NAME DATE, CITY AND COUNTRY OF BIRTH(If known) CITY AND COUNTRY OF RESIDENCE FATHER TA VAN HONG NUN Deceased MOTHER (Maiden name) NAMEN THE NEU NVN Deceased HUSBAND (If none, so state) FAMILY NAME FIRST NAME BIRTHDATE CITY & COUNTRY OF BIRTH DATE OF MARRIAGE PLACE OF MARRIAGE OR (For wife, give maiden name) WIFE FORMER HUSBANDS OR WIVES none,so state) FAMILY NAME (For wife, give maiden name) FIRST NAME BIRTHDATE DATE & PLACE OF MARRIAGE DATE AND PLACE OF TERMINATION OF MARRIAGE APPLICANT'S RESIDENCE LAST FIVE YEARS. LIST PRESENT ADDRESS FIRST. FROM TO STREET AND NUMBER CITY PROVINCE OR STATE COUNTRY MONTH YEAR MONTH YEAR 4631715 VAN ANYET PRESENT TIME street CAIGON SUN Jan 1970 Apr 1975 APPLICANT'S LAST ADDRESS OUTSIDE THE UNITED STATES OF MORE THAN ONE YEAR FROM TO STREET AND NUMBER CITY PROVINCE OR STATE COUNTRY MONTH YEAR MONTH YEAR APPLICANT'S EMPLOYMENT LAST FIVE YEARS. (IF NONE, SO STATE.) LIST PRESENT EMPLOYMENT FIRST. FROM TO FULL NAME AND ADDRESS OF EMPLOYER OCCUPATION (SPECIFY) MONTH YEAR MONTH YEAR PRESENT TIME Show below last occupation abroad if not shown above. (Include all information requested above.) THIS FORM IS SUBMITTED IN CONNECTION WITH APPLICATION FOR: SIGNATURE OF APPLICANT OR PETITIONER DATE NATURALIZATION ADJUSTMENT OF STATUS Refugee user 3 MAY (975 OTHER (SPECIFY): IF YOUR NATIVE ALPHABET IS IN OTHER THAN ROMAN LETTERS. WRITE YOUR NAME IN YOUR NATIVE ALPHABET IN THIS SPACE: Are all copies legible? Yes PENALTIES SEVERE PENALTIES ARE PROVIDED BY LAW FOR KNOWINGLY AND WILLFULLY FALSIFYING OR CONCEALING A MATERIAL FACT. APPLICANT: BE SURE TO PUT YOUR NAME AND ALIEN REGISTRATION NUMBER IN THE BOX OUTLINED BY HEAVY BORDER BELOW. COMPLETE THIS BOX (Family name) (Given name) (Middle name) (Alien registration number) TA VIEN THE (223) 203 456 (OTHER AGENCY USE) INS USE (Office of Origin) VIETNAM REFUGEE Not SL. & 8 low CP PENOLETON, CA FORM G-325A (3) C. 5-1-75"
  },
  {
    "id": "A21203456_0016",
    "page_index": 16,
    "resources": {
      "full_jpg": "https://dctn4zjpwgdwdiiy5odjv7o2se0bqgjb.lambda-url.us-east-1.on.aws/iiif/3/og-2023-kc-nara_A21203456_0016/full/max/0/default.jpg",
      "ocr_txt": true
    },
    "fields": {
      "sex": {
        "ms_sex_llm_v1": "female"
      },
      "doctype": {
        "ms_doctype_v1": "form"
      },
      "form_title": {
        "ms_form_title_llm_v1": "United States Department of Justice Immigration and Naturalization Service Form G-325A ( (REV. 8-27-72N)"
      },
      "is_g325a": true,
      "is_cert_naturalization": false,
      "countries": {
        "ms_countries_nlp_v1": [
          "United States"
        ]
      },
      "years": {
        "ms_years_nlp_v1": [
          1970,
          1975,
          1885
        ]
      },
      "g325a": {
        "occupation": {
          "occupation_llm_v1": "['n.a']"
        },
        "reason": {
          "reason_llm_v1": "Refugee"
        },
        "nationality": {
          "nationality_llm_v1": "VN"
        }
      }
    },
    "anumber": "A21203456",
    "full_text": "FORM G-325A (REV. 8-27-72)N Form Approved UNITED STATES DEPARTMENT OF JUSTICE OMB No. 43-R436 BIOGRAPHIC Immigration and Naturalization Service INFORMATION (Family name) (First name) (Middle name) MALE BIRTHDATE(Mo.-Day-Yr.) NATIONALITY ALIEN REGISTRATION NO. TA VIEW THI FEMALE 1885 VN (427) 203 456 (If ALL OTHER NAMES USED (Including names by previous marriages) CITY AND COUNTRY OF BIRTH SOCIAL SECURITY NO. SON TAY NVN (If any) FAMILY NAME FIRST NAME DATE, CITY AND COUNTRY OF BIRTH(If known) CITY AND COUNTRY OF RESIDENCE FATHER TA VAN HONG NVN Deceased MOTHER (Maiden name) NGUYEN THE NEU NVN Deceased HUSBAND (If none, so state) FAMILY NAME FIRST NAME BIRTHDATE CITY & COUNTRY OF BIRTH OR DATE OF MARRIAGE PLACE OF MARRIAGE WIFE (For wife, give maiden name) FORMER HUSBANDS OR WIVES (if none, so state) FAMILY NAME (For wife, give maiden name) FIRST NAME BIRTHDATE DATE & PLACE OF MARRIAGE DATE AND PLACE OF TERMINATION OF MARRIAGE APPLICANT'S RESIDENCE LAST FIVE YEARS. LIST PRESENT ADDRESS FIRST. FROM TO STREET AND NUMBER CITY PROVINCE OR STATE COUNTRY MONTH YEAR MONTH YEAR 46217 LE VAN DUYET PRESENT TIME Street SAIGON SVN Tan 1970 Apr 1975 APPLICANT'S LAST ADDRESS OUTSIDE THE UNITED STATES OF MORE THAN ONE YEAR FROM TO STREET AND NUMBER CITY PROVINCE OR STATE COUNTRY MONTH YEAR MONTH YEAR APPLICANT'S EMPLOYMENT LAST FIVE YEARS. (IF NONE, SO STATE.) LIST PRESENT EMPLOYMENT FIRST. FROM TO FULL NAME AND ADDRESS OF EMPLOYER OCCUPATION (SPECIFY) MONTH YEAR MONTH YEAR PRESENT TIME Show below last occupation abroad if not shown above. (Include all information requested above.) THIS FORM IS SUBMITTED IN CONNECTION WITH APPLICATION FOR: SIGNATURE OF APPLICANT OR PETITIONER DATE INATURALIZATION ADJUSTMENT OF STATUS OTHER (SPECIFY): Refugee men 3 MAY 1975 IF YOUR NATIVE ALPHABET IS IN OTHER THAN ROMAN LETTERS. WRITE YOUR NAME IN YOUR NATIVE ALPHABET IN THIS SPACE: Are all copies legible? Yes PENALTIES: SEVERE PENALTIES ARE PROVIDED BY LAW FOR KNOWINGLY AND WILLFULLY FALSIFYING OR CONCEALING A MATERIAL FACT."
  },
  {
    "id": "A22484466_0024",
    "page_index": 24,
    "resources": {
      "full_jpg": "https://dctn4zjpwgdwdiiy5odjv7o2se0bqgjb.lambda-url.us-east-1.on.aws/iiif/3/og-2023-kc-nara_A22484466_0024/full/max/0/default.jpg",
      "ocr_txt": true
    },
    "fields": {
      "sex": {
        "ms_sex_llm_v1": "female"
      },
      "doctype": {
        "ms_doctype_v1": "form"
      },
      "form_title": {
        "ms_form_title_llm_v1": "United States Department of Justice Immigration and Naturalization Service, G-325A"
      },
      "is_g325a": true,
      "is_cert_naturalization": false,
      "countries": {
        "ms_countries_nlp_v1": [
          "Thailand",
          "Vietnam",
          "China",
          "United States"
        ]
      },
      "years": {
        "ms_years_nlp_v1": [
          1912,
          1935,
          1978
        ]
      },
      "g325a": {
        "occupation": {
          "occupation_llm_v1": "['retired']"
        },
        "nationality": {
          "nationality_llm_v1": "Vietnamese"
        }
      }
    },
    "anumber": "A22484466",
    "full_text": "INSTRUCTIONS: USE TYPEWRITER. BE SURE ALL COPIES ARE LEGIBLE. Failure to answer fully all questions delays action. C C. -Ct C C C Do Not Remove Carbons: If typewriter is not available, print heavily in block letters with ball-point pen. U.S GOVERNMENT PRINTING OFFICE: 1977-237-015 FORM G-325A (REV. 10-1-74) Y Form Approved UNITED STATES DEPARTMENT OF JUSTICE LOS OMB No. 43-R436 Immigration and Naturalization Service BIOGRAPHIC T/C I INFORMATION SEP 23 1978 (Family name) (First name) (Middle name) MALE BIRTHDATE(Mo.-Day-Yr.) NATIONALITY ALIEN REGISTRATION NO. FEMALE (If any) -TRAN, LIEN THI 1896 Vietnamese A 22 484 466 ALL OTHER NAMES USED (Including names by previous marriages) CITY AND COUNTRY OF BIRTH SOCIAL SECURITY NO. none Saigon, Vietnam -56-7200 FAMILY NAME FIRST NAME DATE, CITY AND COUNTRY OF BIRTH(If known) CITY AND COUNTRY OF RESIDENCE FATHER Tran, Ky ? China Deceased MOTHER(Maiden name) Duong, Lua ? Vietnam Deceased HUSBAND (If none, so state) FAMILY NAME FIRST NAME BIRTHDATE CITY & COUNTRY OF BIRTH DATE OF MARRIAGE PLACE OF MARRIAGE OR (For wife, give maiden name) WIFE none FORMER HUSBANDS OR WIVES(if none, so state) FAMILY NAME (For wife, give maiden name) FIRST NAME BIRTHDATE DATE & PLACE OF MARRIAGE DATE AND PLACE OF TERMINATION OF MARRIAGE Huynh, Phan Phan 1884 1912-Saigon, Vietnam Deceased 1935 APPLICANT'S RESIDENCE LAST FIVE YEARS. LIST PRESENT ADDRESS FIRST. FROM TO STREET AND NUMBER CITY PROVINCE OR STATE COUNTRY MONTH YEAR MONTH YEAR 26981 Ayamonte Mission Viejo Ca USA 08 76 PRESENT TIME Thailand (Camp) 06 76 07 76 513 Hong Bang Saigon Vietnam 34 06 76 APPLICANT'S LAST ADDRESS OUTSIDE THE UNITED STATES OF MORE THAN ONE YEAR FROM TO STREET AND NUMBER CITY PROVINCE OR STATE COUNTRY MONTH YEAR MONTH YEAR 513 Hong Bang Saigon Vietnam 34 06 76 APPLICANT'S EMPLOYMENT LAST FIVE YEARS. (IF NONE, SO STATE.) LIST PRESENT EMPLOYMENT FIRST. FROM TO FULL NAME AND ADDRESS OF EMPLOYER none OCCUPATION (SPECIFY) MONTH YEAR MONTH YEAR PRESENT TIME Show below last occupation abroad if not shown above. (Include all information requested above.) none THIS FORM IS SUBMITTED IN CONNECTION WITH APPLICATION FOR: SIGNATURE OF APPLICANT OR PETITIONER DATE INATURALIZATION ADJUSTMENT OF STATUS t 9 / 23 / 78 OTHER (SPECIFY): IF YOUR NATIVE ALPHABET IS IN OTHER THAN ROMAN LETTERS. WRITE YOUR NAME IN YOUR NATIVE ALPHABET IN THIS SPACE: Are all copies legible? Yes PENALTIES SEVERE PENALTIES ARE PROVIDED BY LAW FOR KNOWINGLY AND WILLFULLY FALSIFYING OR CONCEALING A MATERIAL FACT. APPLICANT: BE SURE TO PUT YOUR NAME AND ALIEN REGISTRATION NUMBER IN THE BOX OUTLINED BY HEAVY BORDER BELOW. COMPLETE THIS BOX (Family name) (Given name) (Middle name) (Alien registration number) TRAN, LIEN HI A 22 484 466 (OTHER AGENCY USE) INS USE (Office of Origin) OFFICE CODE: TYPE OF CASE: DATE: (3) C. FORM G-325A"
  },
  {
    "id": "A22484466_0025",
    "page_index": 25,
    "resources": {
      "full_jpg": "https://dctn4zjpwgdwdiiy5odjv7o2se0bqgjb.lambda-url.us-east-1.on.aws/iiif/3/og-2023-kc-nara_A22484466_0025/full/max/0/default.jpg",
      "ocr_txt": true
    },
    "fields": {
      "sex": {
        "ms_sex_llm_v1": "female"
      },
      "doctype": {
        "ms_doctype_v1": "form"
      },
      "form_title": {
        "ms_form_title_llm_v1": "BIOGRAPHIC INFORMATION, G-325A"
      },
      "is_g325a": true,
      "is_cert_naturalization": false,
      "countries": {
        "ms_countries_nlp_v1": [
          "Thailand",
          "Vietnam",
          "China",
          "United States"
        ]
      },
      "years": {
        "ms_years_nlp_v1": [
          1896,
          1912,
          1935
        ]
      },
      "g325a": {
        "occupation": {
          "occupation_llm_v1": "['retired']"
        },
        "nationality": {
          "nationality_llm_v1": "Vietnamese"
        }
      }
    },
    "anumber": "A22484466",
    "full_text": "Form Approved OMB No. 43-R436 BIOGRAPHIC INFORMATION (Family name) (First name) (Middle name) MALE BIRTHDATE(Mo.-Day-Yr.) NATIONALITY ALIEN REGISTRATION NO. (If any) -TRAN, LIEN THI FEMALE 1896 Vietnamese A 122 484 466 ALL OTHER NAMES USED (Including names by previous marriages) CITY AND COUNTRY OF BIRTH SOCIAL SECURITY NO. Saigon, Vietnam (580)56-7200 none FAMILY NAME FIRST NAME DATE, CITY AND COUNTRY OF BIRTH(If known) CITY AND COUNTRY OF RESIDENCE FATHER Tran, Ky ? China Deceased MOTHER(Maiden name) Duong, Lua ? Vietnam Deceased HUSBAND (If none, so state) FAMILY NAME FIRST NAME BIRTHDATE CITY & COUNTRY OF BIRTH DATE OF MARRIAGE PLACE OF MARRIAGE OR (For wife, give maiden name) WIFE none FORMER HUSBANDS OR WIVES(if none,so state) FAMILY NAME (For wife, give maiden name) FIRST NAME BIRTHDATE DATE & PLACE OF MARRIAGE DATE AND PLACE OF TERMINATION OF MARRIAGE Huynh, Phan Phan 1884 1912-Saigon, Vietnam Deceased 1935 APPLICANT'S RESIDENCE LAST FIVE YEARS. LIST PRESENT ADDRESS FIRST. FROM TO STREET AND NUMBER CITY PROVINCE OR STATE COUNTRY MONTH YEAR MONTH YEAR 08 76 PRESENT TIME 26981 Ayamonte Mission Viejo Ca USA Thailand (Camp) 06 76 07 76 513 Hong Bang Saigon Vietnam 34 06 76 APPLICANT'S LAST ADDRESS OUTSIDE THE UNITED STATES OF MORE THAN ONE YEAR FROM TO STREET AND NUMBER CITY PROVINCE OR STATE COUNTRY MONTH YEAR MONTH YEAR 513 Hong Bang Saigon Vietnam 34 06 76 APPLICANT'S EMPLOYMENT LAST FIVE YEARS. (IF NONE, SO STATE.) LIST PRESENT EMPLOYMENT FIRST. FROM TO FULL NAME AND ADDRESS OF EMPLOYER YEAR MONTH none OCCUPATION (SPECIFY) MONTH YEAR PRESENT TIME Show below last occupation abroad if not shown above. (Include all information requested above.) none THIS FORM IS SUBMITTED IN CONNECTION WITH APPLICATION FOR: SIGNATURE OF APPLICANT OR PETITIONER DATE NATURALIZATION ADJUSTMENT OF STATUS OTHER (SPECIFY): IF YOUR NATIVE ALPHABET IS IN OTHER THAN ROMAN LETTERS. WRITE YOUR NAME IN YOUR NATIVE ALPHABET IN THIS SPACE: Are all copies legible? Yes PENALTIES SEVERE PENALTIES ARE PROVIDED BY LAW FOR KNOWINGLY AND WILLFULLY FALSIFYING OR CONCEALING A MATERIAL FACT. APPLICANT: BE SURE TO PUT YOUR NAME AND ALIEN REGISTRATION NUMBER IN THE BOX OUTLINED BY HEAVY BORDER BELOW. COMPLETE THIS BOX (Family name) (Given name) (Middle name) (Alien registration number) TRAN, LIEN HI A 22 484 466 (OTHER AGENCY USE) INS USE (Office of Origin) OFFICE CODE: TYPE OF CASE: DATE: (3) C. FORM G-325A"
  },
  {
    "id": "A22484466_0026",
    "page_index": 26,
    "resources": {
      "full_jpg": "https://dctn4zjpwgdwdiiy5odjv7o2se0bqgjb.lambda-url.us-east-1.on.aws/iiif/3/og-2023-kc-nara_A22484466_0026/full/max/0/default.jpg",
      "ocr_txt": true
    },
    "fields": {
      "sex": {
        "ms_sex_llm_v1": "female"
      },
      "doctype": {
        "ms_doctype_v1": "form"
      },
      "form_title": {
        "ms_form_title_llm_v1": "Information for Naturalization and Adjustment of Status Application, G-325A"
      },
      "is_g325a": true,
      "is_cert_naturalization": false,
      "countries": {
        "ms_countries_nlp_v1": [
          "Thailand",
          "Vietnam",
          "China",
          "United States"
        ]
      },
      "years": {
        "ms_years_nlp_v1": [
          1896,
          1912,
          1935
        ]
      },
      "g325a": {
        "occupation": {
          "occupation_llm_v1": "['n.a']"
        },
        "nationality": {
          "nationality_llm_v1": "Vietnamese"
        }
      }
    },
    "anumber": "A22484466",
    "full_text": "Form Approved PARTMENT OF JUSTICE OMB No. 43-R436 Immigration and Naturalization Service INFORMATION (Family name) (First name) (Middle name) MALE BIRTHDATE(Mo.-Day-Yr.) NATIONALITY ALIEN REGISTRATION NO. -TRAN, LIEN THI FEMALE 1896 Vietnamese (If any) 22 484 466 ALL OTHER NAMES USED (Including names by previous marriages) CITY AND COUNTRY OF BIRTH SOCIAL SECURITY NO. none Saigon, Vietnam (580-56-7200 FAMILY NAME FIRST NAME DATE, CITY AND COUNTRY OF BIRTH(If known) CITY AND COUNTRY OF RESIDENCE FATHER Tran, Ky ? China Deceased MOTHER (Maiden name) Duong, Lua ? Vietnam Deceased HUSBAND (If none, so state) FAMILY NAME FIRST NAME BIRTHDATE CITY & COUNTRY OF BIRTH DATE OF MARRIAGE PLACE OF MARRIAGE OR (For wife, give maiden name) WIFE none FORMER HUSBANDS OR WIVES( (if none,so state) FAMILY NAME (For wife, give maiden name) FIRST NAME BIRTHDATE DATE & PLACE OF MARRIAGE DATE AND PLACE OF TERMINATION OF MARRIAGE Huynh, Phan Phan 1884 1912-Saigon, Vietnam Deceased 1935 APPLICANT'S RESIDENCE LAST FIVE YEARS. LIST PRESENT ADDRESS FIRST. FROM TO STREET AND NUMBER CITY PROVINCE OR STATE COUNTRY MONTH YEAR MONTH YEAR 26981 Ayamonte Mission Viejo Ca USA 08 76 PRESENT TIME Thailand (Camp) 06 76 07 76 513 Hong Bang Saigon Vietnam 34 06 76 APPLICANT'S LAST ADDRESS OUTSIDE THE UNITED STATES OF MORE THAN ONE YEAR FROM TO STREET AND NUMBER CITY PROVINCE OR STATE COUNTRY MONTH YEAR MONTH YEAR 513 Hong Bang Saigon Vietnam 34 06 76 APPLICANT'S EMPLOYMENT LAST FIVE YEARS. (IF NONE, SO STATE.) LIST PRESENT EMPLOYMENT FIRST. FROM TO FULL NAME AND ADDRESS OF EMPLOYER none OCCUPATION (SPECIFY) MONTH YEAR MONTH YEAR PRESENT TIME Show below last occupation abroad if not shown above. (Include all information requested above.) none THIS FORM IS SUBMITTED IN CONNECTION WITH APPLICATION FOR: SIGNATURE OF APPLICANT OR PETITIONER DATE NATURALIZATION ADJUSTMENT OF STATUS + OTHER (SPECIFY): IF YOUR NATIVE ALPHABET IS IN OTHER THAN ROMAN LETTERS. WRITE YOUR NAME IN YOUR NATIVE ALPHABET IN THIS SPACE: Are all copies legible? Yes PENALTIES SEVERE PENALTIES ARE PROVIDED BY LAW FOR KNOWINGLY AND WILLFULLY FALSIFYING OR CONCEALING A MATERIAL FACT. APPLICANT: BE SURE TO PUT YOUR NAME AND ALIEN REGISTRATION NUMBER IN THE BOX OUTLINED BY HEAVY BORDER BELOW. COMPLETE THIS BOX (Family name) (Given name) (Middle name) (Alien registration number) TRAN, LIEN WHI A 22 484 466 (OTHER AGENCY USE) INS USE (Office of Origin) OFFICE CODE: TYPE OF CASE: DATE: (4) Consul FORM G-325A"
  },
  {
    "id": "A19240402_0074",
    "page_index": 74,
    "resources": {
      "full_jpg": "https://dctn4zjpwgdwdiiy5odjv7o2se0bqgjb.lambda-url.us-east-1.on.aws/iiif/3/og-2023-kc-nara_A19240402_0074/full/max/0/default.jpg",
      "ocr_txt": true
    },
    "fields": {
      "sex": {
        "ms_sex_llm_v1": "female"
      },
      "doctype": {
        "ms_doctype_v1": "form"
      },
      "form_title": {
        "ms_form_title_llm_v1": "United States Department of Justice Immigration and Naturalization Service, G-325A ( (REV. 8-27-72)N"
      },
      "is_g325a": true,
      "is_cert_naturalization": false,
      "countries": {
        "ms_countries_nlp_v1": [
          "United States"
        ]
      },
      "years": {
        "ms_years_nlp_v1": [
          1966,
          1907,
          1903,
          1972,
          1872
        ]
      },
      "g325a": {
        "occupation": {
          "occupation_llm_v1": "['housewife']"
        },
        "reason": {
          "reason_llm_v1": "NATURALIZATION"
        },
        "nationality": {
          "nationality_llm_v1": "Hungarian"
        }
      }
    },
    "anumber": "A19240402",
    "full_text": "FORM G-325A (REV. 8-27-72)N Form Approved UNITED STATES DEPARTMENT OF JUSTICE OMB No. 43-R436 Immigration and Naturalization Service BIOGRAPHIC INFORMATION (Family name) (First name) (Middle name) MALE BIRTHDATE(Mo.-Day-Yr.) NATIONALITY ALIEN REGISTRATION NO. NEMETH ANNA Gabriella FEMALE 3-16-1907 Huggground (If any) 419-240-402 ALL OTHER NAMES USED (Including names by previous marriages) CITY AND COUNTRY OF BIRTH BudAPEst- Hungory SOCIAL SECURITY NO. 326-54-4043 FAMILY NAME FATHER KARDOS. Dezso. 1872 Veszprem Hungery- Deceased FIRST NAME DATE, CITY AND COUNTRY OF BIRTH(If known) CITY AND COUNTRY OF RESIDENCE MOTHER(Maiden name) Csipes. Julienna. 1886 MEZOTUR. Deceased HUSBAND (If none, so state) FAMILY NAME FIRST NAME BIRTHDATE CITY & COUNTRY OF BIRTH DATE OF MARRIAGE PLACE OF MARRIAGE OR (For wife, give maiden name) WIFE n/A FORMER HUSBANDS OR WIVES(i none, so state) FAMILY NAME (For wife, give maiden name) FIRST NAME BIRTHDATE DATE & PLACE OF MARRIAGE DATE AND PLACE OF TERMINATION OF MARRIAGE Nemeth Gabor 1903 / 929 Minor 1966 Hungery by Death APPLICANT'S RESIDENCE LAST FIVE YEARS. LIST PRESENT ADDRESS FIRST. Hangary FROM TO STREET AND NUMBER CITY PROVINCE OR STATE COUNTRY MONTH YEAR MONTH YEAR 3172 N.Shendan Chicogo Illinois U.S.A Jan. 1972 PRESENT TIME APPLICANT'S LAST ADDRESS OUTSIDE THE UNITED STATES OF MORE THAN ONE YEAR FROM TO STREET AND NUMBER CITY PROVINCE OR STATE COUNTRY MONTH YEAR MONTH YEAR 6735Malkenner Schlorssth APPLICANT'S EMPLOYMENT LAST FIVE YEARS. (IF NONE, so STATE.) LIST PRESENT EMPLOYMENT FIRST. 2/23 Gemmy- FROM TO FULL NAME AND ADDRESS OF EMPLOYER OCCUPATION (SPECIFY) MONTH YEAR MONTH YEAR Housewife PRESENT TIME Housewife FORM IS SUBMITTED IN CONNECTION WITH Show below last occupation abroad if not shown above. (Include all information requested above.) THIS APPLICATION FOR: SIGNATURE OF APPLICANT OR PETITIONER NATURALIZATION times Neweth 3/8/74 DATE ADJUSTMENT OF STATUS OTHER (SPECIFY): IF YOUR NATIVE ALPHABET is IN OTHER THAN ROMAN LETTERS. WRITE YOUR NAME IN YOUR NATIVE ALPHABET IN THIS SPACE: Are all copies legible? Yes PENALTIES SEVERE PENALTIES ARE PROVIDED BY LAW FOR KNOWINGLY AND WILLFULLY FALSIFYING OR CONCEALING A MATERIAL FACT."
  }
]